{
    "report_id": "report_266",
    "generated_at": "20251222_143440",
    "scenario_target_ids": [
        "T1592.001",
        "T1592.004",
        "T1590.005",
        "T1199",
        "T1195.001",
        "T1648",
        "T1497.002",
        "T1550.004",
        "T1568.001",
        "T1011.001",
        "T1495"
    ],
    "scenario_flow": [
        "reconnaissance",
        "reconnaissance",
        "reconnaissance",
        "initial-access",
        "initial-access",
        "execution",
        "discovery",
        "lateral-movement",
        "command-and-control",
        "exfiltration",
        "impact"
    ],
    "llm_declared_ids": [
        "T1592.001",
        "T1592.004",
        "T1590.005",
        "T1199",
        "T1195.001",
        "T1648",
        "T1497.002",
        "T1550.004",
        "T1568.001",
        "T1011.001",
        "T1495"
    ],
    "actual_found_ids": [
        "T1011.001",
        "T1199",
        "T1195.001",
        "T1497.002",
        "T1495",
        "T1590.005",
        "T1550.004",
        "T1592.001",
        "T1592.004",
        "T1568.001",
        "T1648"
    ],
    "clean_text": "The Federal Bureau of Investigation (FBI), CISA, and NSA are releasing this joint Cybersecurity Advisory to provide blue teams with training on a fictional APT campaign. CrimsonShadow actors likely initiated reconnaissance by using nmap scans to map IP addresses of public web servers and gather client configuration details, while simultaneously executing wevtutil.exe to query system event logs for hardware information. Following initial access, the group exploited a trusted relationship between compromised networks to pivot and inject malicious PowerShell scripts that enumerated database connection strings. To evade detection, the attackers employed serverless execution by uploading a Python script to an AWS Lambda function and conducted user activity-based checks by searching for 'malware.exe' in memory to identify sandbox environments. For persistence and data theft, malicious code imported browser profile data to restore authenticated sessions using web session cookies, while the malware registered DNS A records via fast flux DNS to blend with legitimate traffic. Exfiltration was achieved through Bluetooth pairing spoofing to transfer stolen data, and the campaign culminated in firmware corruption by overwriting BIOS firmware with a malicious utility to permanently disable hardware. System logs from 2023-10-15 show routine backups at 02:00 UTC, and the targeted organization, 'GlobalTech Inc.', operates in the energy sector with no prior incidents reported.",
    "tagged_text": "The Federal Bureau of Investigation (FBI), CISA, and NSA are releasing this joint Cybersecurity Advisory to provide blue teams with training on a fictional APT campaign. CrimsonShadow actors likely initiated reconnaissance by using nmap scans [T1590.005] to map IP addresses of public web servers and gather client configuration details [T1592.004], while simultaneously executing wevtutil.exe to query system event logs for hardware information [T1592.001]. Following initial access, the group exploited a trusted relationship [T1199] between compromised networks to pivot and inject malicious PowerShell scripts [T1195.001] that enumerated database connection strings. To evade detection, the attackers employed serverless execution [T1648] by uploading a Python script to an AWS Lambda function and conducted user activity-based checks [T1497.002] by searching for 'malware.exe' in memory to identify sandbox environments. For persistence and data theft, malicious code imported browser profile data to restore authenticated sessions using web session cookies [T1550.004], while the malware registered DNS A records via fast flux DNS [T1568.001] to blend with legitimate traffic. Exfiltration was achieved through Bluetooth pairing spoofing [T1011.001] to transfer stolen data, and the campaign culminated in firmware corruption [T1495] by overwriting BIOS firmware with a malicious utility to permanently disable hardware. System logs from 2023-10-15 show routine backups at 02:00 UTC, and the targeted organization, 'GlobalTech Inc.', operates in the energy sector with no prior incidents reported.",
    "sentence_annotations": [
        {
            "sentence": "Following initial access, the group exploited a trusted relationship between compromised networks to pivot and inject malicious PowerShell scripts [T1195.",
            "technique_id": "T1199",
            "technique_name": "Trusted Relationship"
        },
        {
            "sentence": "To evade detection, the attackers employed serverless execution by uploading a Python script to an AWS Lambda function and conducted user activity-based checks [T1497.",
            "technique_id": "T1648",
            "technique_name": "Serverless Execution"
        },
        {
            "sentence": "001] to transfer stolen data, and the campaign culminated in firmware corruption by overwriting BIOS firmware with a malicious utility to permanently disable hardware.",
            "technique_id": "T1495",
            "technique_name": "Firmware Corruption"
        }
    ],
    "llm_raw_response": {
        "title": "Joint Cybersecurity Advisory: Fictional APT Campaign Targeting Critical Infrastructure",
        "summary": "This advisory details a simulated campaign by a fictional advanced persistent threat (APT) group, designated as 'CrimsonShadow', targeting critical infrastructure sectors. The campaign involves sophisticated reconnaissance, exploitation of trusted relationships, and multi-vector exfiltration techniques. Blue teams are advised to review logs, enhance monitoring, and implement defensive measures outlined in this report.",
        "full_report_text": "The Federal Bureau of Investigation (FBI), CISA, and NSA are releasing this joint Cybersecurity Advisory to provide blue teams with training on a fictional APT campaign. CrimsonShadow actors likely initiated reconnaissance by using nmap scans [T1590.005] to map IP addresses of public web servers and gather client configuration details [T1592.004], while simultaneously executing wevtutil.exe to query system event logs for hardware information [T1592.001]. Following initial access, the group exploited a trusted relationship [T1199] between compromised networks to pivot and inject malicious PowerShell scripts [T1195.001] that enumerated database connection strings. To evade detection, the attackers employed serverless execution [T1648] by uploading a Python script to an AWS Lambda function and conducted user activity-based checks [T1497.002] by searching for 'malware.exe' in memory to identify sandbox environments. For persistence and data theft, malicious code imported browser profile data to restore authenticated sessions using web session cookies [T1550.004], while the malware registered DNS A records via fast flux DNS [T1568.001] to blend with legitimate traffic. Exfiltration was achieved through Bluetooth pairing spoofing [T1011.001] to transfer stolen data, and the campaign culminated in firmware corruption [T1495] by overwriting BIOS firmware with a malicious utility to permanently disable hardware. System logs from 2023-10-15 show routine backups at 02:00 UTC, and the targeted organization, 'GlobalTech Inc.', operates in the energy sector with no prior incidents reported.",
        "techniques_used": [
            "T1592.001",
            "T1592.004",
            "T1590.005",
            "T1199",
            "T1195.001",
            "T1648",
            "T1497.002",
            "T1550.004",
            "T1568.001",
            "T1011.001",
            "T1495"
        ]
    }
}