{
    "report_id": "report_68",
    "generated_at": "20251222_131413",
    "scenario_target_ids": [
        "T1593.003",
        "T1598.004",
        "T1583",
        "T1078.001",
        "T1651",
        "T1037.003",
        "T1132.002",
        "T1090.002"
    ],
    "scenario_flow": [
        "reconnaissance",
        "reconnaissance",
        "resource-development",
        "initial-access",
        "execution",
        "persistence",
        "command-and-control",
        "command-and-control"
    ],
    "llm_declared_ids": [
        "T1593.003",
        "T1598.004",
        "T1583",
        "T1078.001",
        "T1651",
        "T1037.003",
        "T1132.002",
        "T1090.002"
    ],
    "actual_found_ids": [
        "T1651",
        "T1583",
        "T1037.003",
        "T1132.002",
        "T1598.004",
        "T1593.003",
        "T1090.002",
        "T1078.001"
    ],
    "clean_text": "Background: Crimson Veil is a suspected state-sponsored group with objectives focused on intellectual property theft and espionage. This report is based on a fictional incident at a mid-sized technology firm, 'TechNova Solutions', which reported anomalous network traffic and unauthorized access to its Azure environment in early 2024.\n\nAttack Narrative: The actors initiated reconnaissance by scanning public code repositories like GitHub, where they discovered leaked corporate credentials from TechNova's development team. Leveraging this information, they conducted spearphishing voice calls to employees, using social engineering tactics to gather additional access details while activating device microphones to capture ambient conversations for further intelligence. To establish infrastructure, Crimson Veil acquired free-tier cloud accounts from providers like AWS and Azure, setting up phishing domains and command-and-control (C2) servers while avoiding financial costs. They then exploited default accounts within TechNova's network, specifically targeting the Guest account that was left enabled with weak credentials, gaining initial foothold into the system. Once inside, the actors used cloud administration commands, such as Azure RunCommand, to execute PowerShell scripts on virtual machines, enabling lateral movement and payload deployment. To maintain persistence, they altered Group Policy settings to run a backdoor script from a remote server at system startup, embedding malicious code into network logon processes. For evasion, the malicious script encoded its C2 payloads using a non-standard encoding scheme, replacing standard Base64 characters with special symbols to bypass detection. Finally, they employed external proxies, utilizing a modified version of HTRAN to redirect connections between networks, facilitating data exfiltration and obscuring their origin.\n\nIrrelevant Information: TechNova Solutions, founded in 2010, specializes in cloud-based analytics software and employs over 500 staff. During the incident, system logs showed routine backup processes at 02:00 UTC, unrelated to the attack. The company's internal investigation noted increased CPU usage on VM 'analytics-prod-01', but this was later attributed to a scheduled data processing job.",
    "tagged_text": "Background: Crimson Veil is a suspected state-sponsored group with objectives focused on intellectual property theft and espionage. This report is based on a fictional incident at a mid-sized technology firm, 'TechNova Solutions', which reported anomalous network traffic and unauthorized access to its Azure environment in early 2024.\n\nAttack Narrative: The actors initiated reconnaissance by scanning public code repositories like GitHub, where they discovered leaked corporate credentials from TechNova's development team [T1593.003]. Leveraging this information, they conducted spearphishing voice calls to employees, using social engineering tactics to gather additional access details while activating device microphones to capture ambient conversations for further intelligence [T1598.004]. To establish infrastructure, Crimson Veil acquired free-tier cloud accounts from providers like AWS and Azure, setting up phishing domains and command-and-control (C2) servers while avoiding financial costs [T1583]. They then exploited default accounts within TechNova's network, specifically targeting the Guest account that was left enabled with weak credentials, gaining initial foothold into the system [T1078.001]. Once inside, the actors used cloud administration commands, such as Azure RunCommand, to execute PowerShell scripts on virtual machines, enabling lateral movement and payload deployment [T1651]. To maintain persistence, they altered Group Policy settings to run a backdoor script from a remote server at system startup, embedding malicious code into network logon processes [T1037.003]. For evasion, the malicious script encoded its C2 payloads using a non-standard encoding scheme, replacing standard Base64 characters with special symbols to bypass detection [T1132.002]. Finally, they employed external proxies, utilizing a modified version of HTRAN to redirect connections between networks, facilitating data exfiltration and obscuring their origin [T1090.002].\n\nIrrelevant Information: TechNova Solutions, founded in 2010, specializes in cloud-based analytics software and employs over 500 staff. During the incident, system logs showed routine backup processes at 02:00 UTC, unrelated to the attack. The company's internal investigation noted increased CPU usage on VM 'analytics-prod-01', but this was later attributed to a scheduled data processing job.",
    "sentence_annotations": [
        {
            "sentence": "To establish infrastructure, Crimson Veil acquired free-tier cloud accounts from providers like AWS and Azure, setting up phishing domains and command-and-control (C2) servers while avoiding financial costs.",
            "technique_id": "T1583",
            "technique_name": "Acquire Infrastructure"
        },
        {
            "sentence": "Once inside, the actors used cloud administration commands, such as Azure RunCommand, to execute PowerShell scripts on virtual machines, enabling lateral movement and payload deployment.",
            "technique_id": "T1651",
            "technique_name": "Cloud Administration Command"
        }
    ],
    "llm_raw_response": {
        "title": "Joint Cybersecurity Advisory: Fictional Campaign 'Crimson Veil' Targeting Cloud Infrastructure",
        "summary": "This advisory details a simulated campaign by a fictional threat actor group, designated 'Crimson Veil', targeting organizations using cloud services. The activity involves initial access via leaked credentials, social engineering, and exploitation of default configurations, leading to command execution and data exfiltration through obfuscated channels.",
        "full_report_text": "Background: Crimson Veil is a suspected state-sponsored group with objectives focused on intellectual property theft and espionage. This report is based on a fictional incident at a mid-sized technology firm, 'TechNova Solutions', which reported anomalous network traffic and unauthorized access to its Azure environment in early 2024.\n\nAttack Narrative: The actors initiated reconnaissance by scanning public code repositories like GitHub, where they discovered leaked corporate credentials from TechNova's development team [T1593.003]. Leveraging this information, they conducted spearphishing voice calls to employees, using social engineering tactics to gather additional access details while activating device microphones to capture ambient conversations for further intelligence [T1598.004]. To establish infrastructure, Crimson Veil acquired free-tier cloud accounts from providers like AWS and Azure, setting up phishing domains and command-and-control (C2) servers while avoiding financial costs [T1583]. They then exploited default accounts within TechNova's network, specifically targeting the Guest account that was left enabled with weak credentials, gaining initial foothold into the system [T1078.001]. Once inside, the actors used cloud administration commands, such as Azure RunCommand, to execute PowerShell scripts on virtual machines, enabling lateral movement and payload deployment [T1651]. To maintain persistence, they altered Group Policy settings to run a backdoor script from a remote server at system startup, embedding malicious code into network logon processes [T1037.003]. For evasion, the malicious script encoded its C2 payloads using a non-standard encoding scheme, replacing standard Base64 characters with special symbols to bypass detection [T1132.002]. Finally, they employed external proxies, utilizing a modified version of HTRAN to redirect connections between networks, facilitating data exfiltration and obscuring their origin [T1090.002].\n\nIrrelevant Information: TechNova Solutions, founded in 2010, specializes in cloud-based analytics software and employs over 500 staff. During the incident, system logs showed routine backup processes at 02:00 UTC, unrelated to the attack. The company's internal investigation noted increased CPU usage on VM 'analytics-prod-01', but this was later attributed to a scheduled data processing job.",
        "techniques_used": [
            "T1593.003",
            "T1598.004",
            "T1583",
            "T1078.001",
            "T1651",
            "T1037.003",
            "T1132.002",
            "T1090.002"
        ]
    }
}