{
    "report_id": "report_428",
    "generated_at": "20251222_154258",
    "scenario_target_ids": [
        "T1598.002",
        "T1195.002",
        "T1059.004",
        "T1059.002",
        "T1205.001",
        "T1102"
    ],
    "scenario_flow": [
        "reconnaissance",
        "initial-access",
        "execution",
        "execution",
        "persistence",
        "command-and-control"
    ],
    "llm_declared_ids": [
        "T1598.002",
        "T1195.002",
        "T1059.004",
        "T1059.002",
        "T1205.001",
        "T1102"
    ],
    "actual_found_ids": [
        "T1195.002",
        "T1205.001",
        "T1059.004",
        "T1102",
        "T1598.002",
        "T1059.002"
    ],
    "clean_text": "The Federal Bureau of Investigation (FBI), CISA, and NSA are releasing this joint Cybersecurity Advisory to provide actionable intelligence on a fictional APT campaign, 'SilentVector', observed targeting critical infrastructure organizations. This report is based on a simulated attack scenario for educational purposes, incorporating realistic but fictitious elements to train defensive teams. The campaign begins with initial access where actors conduct reconnaissance by sending spearphishing emails with malicious attachments to key personnel, while simultaneously compromising a software supply chain by replacing a legitimate binary on a distribution server with a trojanized version. Upon execution, the adversary employs Unix shell commands to survey compromised Linux systems and gather sensitive information, concurrently using AppleScript on macOS devices to generate deceptive prompts and manipulate files. For persistence and C2, the malware implements port knocking to establish hidden raw socket connections, and abuses web services by embedding exfiltrated credentials into search queries via Google's API. System logs from a fictional victim, 'InfraCorp', show unusual network traffic spikes and unauthorized file modifications, though some entries are benign noise from routine maintenance. Background: InfraCorp is a mid-sized energy provider with hybrid cloud infrastructure, and this scenario assumes prior security audits revealed no critical vulnerabilities. The actors' tactics demonstrate a blend of cross-platform exploitation and stealth, emphasizing the need for robust monitoring and incident response protocols.",
    "tagged_text": "The Federal Bureau of Investigation (FBI), CISA, and NSA are releasing this joint Cybersecurity Advisory to provide actionable intelligence on a fictional APT campaign, 'SilentVector', observed targeting critical infrastructure organizations. This report is based on a simulated attack scenario for educational purposes, incorporating realistic but fictitious elements to train defensive teams. The campaign begins with initial access where actors conduct reconnaissance [T1598.002] by sending spearphishing emails with malicious attachments to key personnel, while simultaneously compromising a software supply chain [T1195.002] by replacing a legitimate binary on a distribution server with a trojanized version. Upon execution, the adversary employs Unix shell commands [T1059.004] to survey compromised Linux systems and gather sensitive information, concurrently using AppleScript [T1059.002] on macOS devices to generate deceptive prompts and manipulate files. For persistence and C2, the malware implements port knocking [T1205.001] to establish hidden raw socket connections, and abuses web services [T1102] by embedding exfiltrated credentials into search queries via Google's API. System logs from a fictional victim, 'InfraCorp', show unusual network traffic spikes and unauthorized file modifications, though some entries are benign noise from routine maintenance. Background: InfraCorp is a mid-sized energy provider with hybrid cloud infrastructure, and this scenario assumes prior security audits revealed no critical vulnerabilities. The actors' tactics demonstrate a blend of cross-platform exploitation and stealth, emphasizing the need for robust monitoring and incident response protocols.",
    "sentence_annotations": [
        {
            "sentence": "001] to establish hidden raw socket connections, and abuses web services by embedding exfiltrated credentials into search queries via Google's API.",
            "technique_id": "T1102",
            "technique_name": "Web Service"
        }
    ],
    "llm_raw_response": {
        "title": "Joint Cybersecurity Advisory: Fictional APT Campaign 'SilentVector' Targeting Critical Infrastructure",
        "summary": "This advisory details a simulated campaign by a fictional advanced persistent threat (APT) group, designated 'SilentVector', targeting critical infrastructure sectors. The campaign involves sophisticated initial access through supply chain compromise and phishing, followed by multi-platform execution and stealthy command and control (C2) techniques. The scenario is designed for blue team training to enhance detection and response capabilities against complex, multi-vector attacks.",
        "full_report_text": "The Federal Bureau of Investigation (FBI), CISA, and NSA are releasing this joint Cybersecurity Advisory to provide actionable intelligence on a fictional APT campaign, 'SilentVector', observed targeting critical infrastructure organizations. This report is based on a simulated attack scenario for educational purposes, incorporating realistic but fictitious elements to train defensive teams. The campaign begins with initial access where actors conduct reconnaissance [T1598.002] by sending spearphishing emails with malicious attachments to key personnel, while simultaneously compromising a software supply chain [T1195.002] by replacing a legitimate binary on a distribution server with a trojanized version. Upon execution, the adversary employs Unix shell commands [T1059.004] to survey compromised Linux systems and gather sensitive information, concurrently using AppleScript [T1059.002] on macOS devices to generate deceptive prompts and manipulate files. For persistence and C2, the malware implements port knocking [T1205.001] to establish hidden raw socket connections, and abuses web services [T1102] by embedding exfiltrated credentials into search queries via Google's API. System logs from a fictional victim, 'InfraCorp', show unusual network traffic spikes and unauthorized file modifications, though some entries are benign noise from routine maintenance. Background: InfraCorp is a mid-sized energy provider with hybrid cloud infrastructure, and this scenario assumes prior security audits revealed no critical vulnerabilities. The actors' tactics demonstrate a blend of cross-platform exploitation and stealth, emphasizing the need for robust monitoring and incident response protocols.",
        "techniques_used": [
            "T1598.002",
            "T1195.002",
            "T1059.004",
            "T1059.002",
            "T1205.001",
            "T1102"
        ]
    }
}