{
    "report_id": "report_94",
    "generated_at": "20251222_132353",
    "scenario_target_ids": [
        "T1589.001",
        "T1195.003",
        "T1204.002",
        "T1046",
        "T1040",
        "T1072",
        "T1659"
    ],
    "scenario_flow": [
        "reconnaissance",
        "initial-access",
        "execution",
        "discovery",
        "discovery",
        "lateral-movement",
        "command-and-control"
    ],
    "llm_declared_ids": [
        "T1589",
        "T1589.001",
        "T1195.003",
        "T1204.002",
        "T1059.001",
        "T1072",
        "T1659",
        "T1046",
        "T1040"
    ],
    "actual_found_ids": [
        "T1046",
        "T1589",
        "T1659",
        "T1195.003",
        "T1040",
        "T1072",
        "T1589.001",
        "T1204.002",
        "T1059.001"
    ],
    "clean_text": "On 2023-10-15, security analysts at a fictional energy company, 'GridSecure Inc.', detected anomalous network traffic originating from an internal workstation. Initial investigation revealed a coordinated attack campaign with the following kill-chain progression. In the initial access phase, the actors likely conducted reconnaissance to identify employee targets, then sent phishing emails with links to malicious websites designed to harvest authentication credentials, while simultaneously exploiting a compromised hardware supply chain by deploying reprogrammed Teensy USB devices that mounted as storage containing malware for automatic execution. Upon execution, the adversary delivered macro-enabled documents requiring targets to enable content, which executed malicious payloads and leveraged PowerShell to download additional tools. System logs from the infected workstation showed unusual process creation events at 14:30 UTC, coinciding with a scheduled maintenance window. In the persistence phase, the malware exploited Software Deployment Tools like SCCM to execute commands that established persistence on all corporate devices, and the actors used content injection into DNS and HTTP replies to redirect targeted hosts to download malicious files. During lateral movement, the adversary employed network service discovery tools such as NetScan to enumerate services and conducted network sniffing with tools like intercepter-NG to capture passwords in traffic. Background: GridSecure Inc. operates multiple power plants across the region, with a legacy IT infrastructure partially migrated to cloud services. The attack was contained after 48 hours, with no operational impact reported. Recommendations include implementing multi-factor authentication and monitoring for unauthorized USB devices.",
    "tagged_text": "On 2023-10-15, security analysts at a fictional energy company, 'GridSecure Inc.', detected anomalous network traffic originating from an internal workstation. Initial investigation revealed a coordinated attack campaign with the following kill-chain progression. In the initial access phase, the actors likely conducted reconnaissance [T1589] to identify employee targets, then sent phishing emails with links to malicious websites designed to harvest authentication credentials [T1589.001], while simultaneously exploiting a compromised hardware supply chain by deploying reprogrammed Teensy USB devices that mounted as storage containing malware for automatic execution [T1195.003]. Upon execution, the adversary delivered macro-enabled documents requiring targets to enable content, which executed malicious payloads [T1204.002] and leveraged PowerShell to download additional tools [T1059.001]. System logs from the infected workstation showed unusual process creation events at 14:30 UTC, coinciding with a scheduled maintenance window. In the persistence phase, the malware exploited Software Deployment Tools like SCCM to execute commands that established persistence on all corporate devices [T1072], and the actors used content injection into DNS and HTTP replies to redirect targeted hosts to download malicious files [T1659]. During lateral movement, the adversary employed network service discovery tools such as NetScan to enumerate services [T1046] and conducted network sniffing with tools like intercepter-NG to capture passwords in traffic [T1040]. Background: GridSecure Inc. operates multiple power plants across the region, with a legacy IT infrastructure partially migrated to cloud services. The attack was contained after 48 hours, with no operational impact reported. Recommendations include implementing multi-factor authentication and monitoring for unauthorized USB devices.",
    "sentence_annotations": [
        {
            "sentence": "In the initial access phase, the actors likely conducted reconnaissance to identify employee targets, then sent phishing emails with links to malicious websites designed to harvest authentication credentials [T1589.",
            "technique_id": "T1589",
            "technique_name": "Gather Victim Identity Information"
        },
        {
            "sentence": "In the persistence phase, the malware exploited Software Deployment Tools like SCCM to execute commands that established persistence on all corporate devices, and the actors used content injection into DNS and HTTP replies to redirect targeted hosts to download malicious files.",
            "technique_id": "T1072",
            "technique_name": "Software Deployment Tools"
        },
        {
            "sentence": "In the persistence phase, the malware exploited Software Deployment Tools like SCCM to execute commands that established persistence on all corporate devices, and the actors used content injection into DNS and HTTP replies to redirect targeted hosts to download malicious files.",
            "technique_id": "T1659",
            "technique_name": "Content Injection"
        },
        {
            "sentence": "During lateral movement, the adversary employed network service discovery tools such as NetScan to enumerate services and conducted network sniffing with tools like intercepter-NG to capture passwords in traffic.",
            "technique_id": "T1046",
            "technique_name": "Network Service Discovery"
        },
        {
            "sentence": "During lateral movement, the adversary employed network service discovery tools such as NetScan to enumerate services and conducted network sniffing with tools like intercepter-NG to capture passwords in traffic.",
            "technique_id": "T1040",
            "technique_name": "Network Sniffing"
        }
    ],
    "llm_raw_response": {
        "title": "Joint Cybersecurity Advisory: Fictional APT Campaign 'ShadowHook' Targeting Critical Infrastructure",
        "summary": "This advisory details a simulated campaign by a fictional threat actor group, designated as 'ShadowHook', targeting critical infrastructure sectors. The campaign involves a multi-vector initial access approach, leveraging phishing, supply chain compromise, and content injection to deploy malware, conduct network reconnaissance, and establish persistence across corporate environments. Blue teams are advised to review detection and mitigation strategies.",
        "full_report_text": "On 2023-10-15, security analysts at a fictional energy company, 'GridSecure Inc.', detected anomalous network traffic originating from an internal workstation. Initial investigation revealed a coordinated attack campaign with the following kill-chain progression. In the initial access phase, the actors likely conducted reconnaissance [T1589] to identify employee targets, then sent phishing emails with links to malicious websites designed to harvest authentication credentials [T1589.001], while simultaneously exploiting a compromised hardware supply chain by deploying reprogrammed Teensy USB devices that mounted as storage containing malware for automatic execution [T1195.003]. Upon execution, the adversary delivered macro-enabled documents requiring targets to enable content, which executed malicious payloads [T1204.002] and leveraged PowerShell to download additional tools [T1059.001]. System logs from the infected workstation showed unusual process creation events at 14:30 UTC, coinciding with a scheduled maintenance window. In the persistence phase, the malware exploited Software Deployment Tools like SCCM to execute commands that established persistence on all corporate devices [T1072], and the actors used content injection into DNS and HTTP replies to redirect targeted hosts to download malicious files [T1659]. During lateral movement, the adversary employed network service discovery tools such as NetScan to enumerate services [T1046] and conducted network sniffing with tools like intercepter-NG to capture passwords in traffic [T1040]. Background: GridSecure Inc. operates multiple power plants across the region, with a legacy IT infrastructure partially migrated to cloud services. The attack was contained after 48 hours, with no operational impact reported. Recommendations include implementing multi-factor authentication and monitoring for unauthorized USB devices.",
        "techniques_used": [
            "T1589",
            "T1589.001",
            "T1195.003",
            "T1204.002",
            "T1059.001",
            "T1072",
            "T1659",
            "T1046",
            "T1040"
        ]
    }
}