{
    "report_id": "report_98",
    "generated_at": "20251222_115603",
    "scenario_target_ids": [
        "T1586.002",
        "T1608.006",
        "T1091",
        "T1566",
        "T1059.012",
        "T1059.008",
        "T1547.013",
        "T1484.002",
        "T1027.006",
        "T1482",
        "T1021.008",
        "T1074",
        "T1056",
        "T1132",
        "T1205"
    ],
    "scenario_flow": [
        "resource-development",
        "resource-development",
        "initial-access",
        "initial-access",
        "execution",
        "execution",
        "persistence",
        "privilege-escalation",
        "defense-evasion",
        "discovery",
        "lateral-movement",
        "collection",
        "collection",
        "command-and-control",
        "command-and-control"
    ],
    "llm_declared_ids": [
        "T1586.002",
        "T1608.006",
        "T1091",
        "T1566",
        "T1059.012",
        "T1059.008",
        "T1547.013",
        "T1484.002",
        "T1027.006",
        "T1482",
        "T1021.008",
        "T1074",
        "T1056",
        "T1132",
        "T1205"
    ],
    "actual_found_ids": [
        "T1484.002",
        "T1074",
        "T1132",
        "T1059.008",
        "T1205",
        "T1027.006",
        "T1056",
        "T1547.013",
        "T1482",
        "T1021.008",
        "T1608.006",
        "T1091",
        "T1566",
        "T1586.002",
        "T1059.012"
    ],
    "clean_text": "CrimsonViper likely conducted reconnaissance on GridSecure Inc., a fictional energy provider with operations in North America and Europe, focusing on its public-facing assets and employee directories. The actors then initiated the attack by using compromised email accounts to send spearphishing emails containing weaponized PDF attachments that exploited a vulnerability in Adobe Reader, while simultaneously embedding hidden keywords in white text on white backgrounds within a compromised website's header section for SEO poisoning. Upon execution, the malware replicated through removable media by modifying the Autorun.inf file to execute automatically when a USB was inserted, and it altered the /etc/xdg/autostart/malicious.desktop configuration to establish persistence via XDG autostart entries. For lateral movement, the adversary employed the Hypervisor CLI using `esxcli` to terminate running virtual machines and utilized the Network Device CLI to execute commands modifying firewall rules and allow unauthorized inbound connections, while also leveraging the Azure Serial Console for direct cloud VM connections to bypass network security controls. In the defense evasion phase, the threat actor used HTML smuggling by writing malicious.html with hidden iframes to deliver malware and employed gzip compression for data encoding to conceal command structures in network traffic, alongside crafting custom packets using raw sockets for traffic signaling to signal the opening of hidden backdoor ports. For credential access and discovery, the actors altered Active Directory Federation Services settings for trust modification to redirect authentication requests and used tools to capture mouse movements for input capture, while the reconnaissance tool called DSEnumerateDomainTrusts() for domain trust discovery. Finally, the malicious script utilized bash commands to save collected browser cookies to an encrypted container for data staging, with system logs from GridSecure's SIEM showing anomalous network traffic patterns and failed login attempts from unrecognized IP addresses, though no actual data breach occurred in this fictional scenario.",
    "tagged_text": "CrimsonViper likely conducted reconnaissance on GridSecure Inc., a fictional energy provider with operations in North America and Europe, focusing on its public-facing assets and employee directories. The actors then initiated the attack by using compromised email accounts [T1586.002] to send spearphishing emails [T1566] containing weaponized PDF attachments that exploited a vulnerability in Adobe Reader, while simultaneously embedding hidden keywords in white text on white backgrounds within a compromised website's header section for SEO poisoning [T1608.006]. Upon execution, the malware replicated through removable media [T1091] by modifying the Autorun.inf file to execute automatically when a USB was inserted, and it altered the /etc/xdg/autostart/malicious.desktop configuration to establish persistence via XDG autostart entries [T1547.013]. For lateral movement, the adversary employed the Hypervisor CLI [T1059.012] using `esxcli` to terminate running virtual machines and utilized the Network Device CLI [T1059.008] to execute commands modifying firewall rules and allow unauthorized inbound connections, while also leveraging the Azure Serial Console for direct cloud VM connections [T1021.008] to bypass network security controls. In the defense evasion phase, the threat actor used HTML smuggling [T1027.006] by writing malicious.html with hidden iframes to deliver malware and employed gzip compression for data encoding [T1132] to conceal command structures in network traffic, alongside crafting custom packets using raw sockets for traffic signaling [T1205] to signal the opening of hidden backdoor ports. For credential access and discovery, the actors altered Active Directory Federation Services settings for trust modification [T1484.002] to redirect authentication requests and used tools to capture mouse movements for input capture [T1056], while the reconnaissance tool called DSEnumerateDomainTrusts() for domain trust discovery [T1482]. Finally, the malicious script utilized bash commands to save collected browser cookies to an encrypted container for data staging [T1074], with system logs from GridSecure's SIEM showing anomalous network traffic patterns and failed login attempts from unrecognized IP addresses, though no actual data breach occurred in this fictional scenario.",
    "sentence_annotations": [
        {
            "sentence": "002] to send spearphishing emails containing weaponized PDF attachments that exploited a vulnerability in Adobe Reader, while simultaneously embedding hidden keywords in white text on white backgrounds within a compromised website's header section for SEO poisoning [T1608.",
            "technique_id": "T1566",
            "technique_name": "Phishing"
        },
        {
            "sentence": "Upon execution, the malware replicated through removable media by modifying the Autorun.",
            "technique_id": "T1091",
            "technique_name": "Replication Through Removable Media"
        },
        {
            "sentence": "html with hidden iframes to deliver malware and employed gzip compression for data encoding to conceal command structures in network traffic, alongside crafting custom packets using raw sockets for traffic signaling to signal the opening of hidden backdoor ports.",
            "technique_id": "T1132",
            "technique_name": "Data Encoding"
        },
        {
            "sentence": "html with hidden iframes to deliver malware and employed gzip compression for data encoding to conceal command structures in network traffic, alongside crafting custom packets using raw sockets for traffic signaling to signal the opening of hidden backdoor ports.",
            "technique_id": "T1205",
            "technique_name": "Traffic Signaling"
        },
        {
            "sentence": "002] to redirect authentication requests and used tools to capture mouse movements for input capture, while the reconnaissance tool called DSEnumerateDomainTrusts() for domain trust discovery.",
            "technique_id": "T1056",
            "technique_name": "Input Capture"
        },
        {
            "sentence": "002] to redirect authentication requests and used tools to capture mouse movements for input capture, while the reconnaissance tool called DSEnumerateDomainTrusts() for domain trust discovery.",
            "technique_id": "T1482",
            "technique_name": "Domain Trust Discovery"
        },
        {
            "sentence": "Finally, the malicious script utilized bash commands to save collected browser cookies to an encrypted container for data staging, with system logs from GridSecure's SIEM showing anomalous network traffic patterns and failed login attempts from unrecognized IP addresses, though no actual data breach occurred in this fictional scenario.",
            "technique_id": "T1074",
            "technique_name": "Data Staged"
        }
    ],
    "llm_raw_response": {
        "title": "Joint Cybersecurity Advisory: Fictional APT Campaign 'CrimsonViper' Targeting Critical Infrastructure",
        "summary": "This advisory details a simulated campaign by the fictional threat actor CrimsonViper, which targeted a mid-sized energy company, 'GridSecure Inc.', between January and March 2024. The campaign involved a multi-vector initial access approach, leveraging spearphishing and SEO poisoning, followed by lateral movement, persistence mechanisms, and data exfiltration. Techniques observed include email account compromise, hypervisor and network device CLI manipulation, and advanced evasion methods like HTML smuggling and traffic signaling. This report is intended for blue team training to enhance detection and response capabilities in similar scenarios.",
        "full_report_text": "CrimsonViper likely conducted reconnaissance on GridSecure Inc., a fictional energy provider with operations in North America and Europe, focusing on its public-facing assets and employee directories. The actors then initiated the attack by using compromised email accounts [T1586.002] to send spearphishing emails [T1566] containing weaponized PDF attachments that exploited a vulnerability in Adobe Reader, while simultaneously embedding hidden keywords in white text on white backgrounds within a compromised website's header section for SEO poisoning [T1608.006]. Upon execution, the malware replicated through removable media [T1091] by modifying the Autorun.inf file to execute automatically when a USB was inserted, and it altered the /etc/xdg/autostart/malicious.desktop configuration to establish persistence via XDG autostart entries [T1547.013]. For lateral movement, the adversary employed the Hypervisor CLI [T1059.012] using `esxcli` to terminate running virtual machines and utilized the Network Device CLI [T1059.008] to execute commands modifying firewall rules and allow unauthorized inbound connections, while also leveraging the Azure Serial Console for direct cloud VM connections [T1021.008] to bypass network security controls. In the defense evasion phase, the threat actor used HTML smuggling [T1027.006] by writing malicious.html with hidden iframes to deliver malware and employed gzip compression for data encoding [T1132] to conceal command structures in network traffic, alongside crafting custom packets using raw sockets for traffic signaling [T1205] to signal the opening of hidden backdoor ports. For credential access and discovery, the actors altered Active Directory Federation Services settings for trust modification [T1484.002] to redirect authentication requests and used tools to capture mouse movements for input capture [T1056], while the reconnaissance tool called DSEnumerateDomainTrusts() for domain trust discovery [T1482]. Finally, the malicious script utilized bash commands to save collected browser cookies to an encrypted container for data staging [T1074], with system logs from GridSecure's SIEM showing anomalous network traffic patterns and failed login attempts from unrecognized IP addresses, though no actual data breach occurred in this fictional scenario.",
        "techniques_used": [
            "T1586.002",
            "T1608.006",
            "T1091",
            "T1566",
            "T1059.012",
            "T1059.008",
            "T1547.013",
            "T1484.002",
            "T1027.006",
            "T1482",
            "T1021.008",
            "T1074",
            "T1056",
            "T1132",
            "T1205"
        ]
    }
}