{
    "report_id": "report_224",
    "generated_at": "20251222_141734",
    "scenario_target_ids": [
        "T1590.003",
        "T1598.001",
        "T1200",
        "T1566.002",
        "T1559.002",
        "T1622",
        "T1025",
        "T1213.001",
        "T1213.003",
        "T1568.001"
    ],
    "scenario_flow": [
        "reconnaissance",
        "reconnaissance",
        "initial-access",
        "initial-access",
        "execution",
        "discovery",
        "collection",
        "collection",
        "collection",
        "command-and-control"
    ],
    "llm_declared_ids": [
        "T1590.003",
        "T1598.001",
        "T1200",
        "T1566.002",
        "T1559.002",
        "T1622",
        "T1025",
        "T1213.001",
        "T1213.003",
        "T1568.001"
    ],
    "actual_found_ids": [
        "T1622",
        "T1590.003",
        "T1213.003",
        "T1568.001",
        "T1200",
        "T1566.002",
        "T1213.001",
        "T1559.002",
        "T1025",
        "T1598.001"
    ],
    "clean_text": "The Federal Bureau of Investigation (FBI), CISA, and NSA are releasing this joint Cybersecurity Advisory to provide a fictional, educational overview of APT activity observed in training scenarios. CrimsonViper actors likely conduct reconnaissance by gathering information on network trust dependencies through spear-phishing campaigns targeting administrators with fake security audit requests. They employed spearphishing services via Outlook.com to distribute malicious emails containing credential harvesting links while simultaneously using spearphishing links to deliver .hta files that executed payloads. In one incident, a USB Rubber Ducky was utilized for hardware additions to establish remote access, and data from removable media was collected using the FunnyDream FilePakMonitor component. The attackers leveraged Dynamic Data Exchange in phishing documents to run system commands without user interaction and implemented debugger evasion by using the CheckRemoteDebuggerPresent function to detect debuggers. For data collection, they queried Confluence repositories for API documentation and used git submodule initialization to download proprietary libraries from private code repositories. Additionally, the botnet controller employed fast flux DNS by de-registering DNS A records for domains flagged by security vendors. System logs from the targeted organization, 'SecureCorp Inc.', a mid-sized energy provider, showed normal authentication events during the attack, with no immediate alerts triggered. The company's background includes recent mergers, but this information is unrelated to the intrusion. Network traffic analysis revealed benign HTTP requests to internal servers, which were not part of the malicious activity.",
    "tagged_text": "The Federal Bureau of Investigation (FBI), CISA, and NSA are releasing this joint Cybersecurity Advisory to provide a fictional, educational overview of APT activity observed in training scenarios. CrimsonViper actors likely conduct reconnaissance by gathering information on network trust dependencies [T1590.003] through spear-phishing campaigns targeting administrators with fake security audit requests. They employed spearphishing services [T1598.001] via Outlook.com to distribute malicious emails containing credential harvesting links while simultaneously using spearphishing links [T1566.002] to deliver .hta files that executed payloads. In one incident, a USB Rubber Ducky was utilized for hardware additions [T1200] to establish remote access, and data from removable media [T1025] was collected using the FunnyDream FilePakMonitor component. The attackers leveraged Dynamic Data Exchange [T1559.002] in phishing documents to run system commands without user interaction and implemented debugger evasion [T1622] by using the CheckRemoteDebuggerPresent function to detect debuggers. For data collection, they queried Confluence repositories [T1213.001] for API documentation and used git submodule initialization [T1213.003] to download proprietary libraries from private code repositories. Additionally, the botnet controller employed fast flux DNS [T1568.001] by de-registering DNS A records for domains flagged by security vendors. System logs from the targeted organization, 'SecureCorp Inc.', a mid-sized energy provider, showed normal authentication events during the attack, with no immediate alerts triggered. The company's background includes recent mergers, but this information is unrelated to the intrusion. Network traffic analysis revealed benign HTTP requests to internal servers, which were not part of the malicious activity.",
    "sentence_annotations": [
        {
            "sentence": "In one incident, a USB Rubber Ducky was utilized for hardware additions to establish remote access, and data from removable media was collected using the FunnyDream FilePakMonitor component.",
            "technique_id": "T1200",
            "technique_name": "Hardware Additions"
        },
        {
            "sentence": "In one incident, a USB Rubber Ducky was utilized for hardware additions to establish remote access, and data from removable media was collected using the FunnyDream FilePakMonitor component.",
            "technique_id": "T1025",
            "technique_name": "Data from Removable Media"
        },
        {
            "sentence": "002] in phishing documents to run system commands without user interaction and implemented debugger evasion by using the CheckRemoteDebuggerPresent function to detect debuggers.",
            "technique_id": "T1622",
            "technique_name": "Debugger Evasion"
        }
    ],
    "llm_raw_response": {
        "title": "Joint Cybersecurity Advisory: Fictional APT Campaign Targeting Critical Infrastructure",
        "summary": "This advisory details a simulated campaign by a fictional advanced persistent threat (APT) group, designated as 'CrimsonViper', targeting network administrators and critical infrastructure organizations. The campaign leverages spear-phishing, hardware-based attacks, and data exfiltration techniques to compromise systems and evade detection. Blue teams are advised to review the tactics, techniques, and procedures (TTPs) outlined for training and defensive purposes.",
        "full_report_text": "The Federal Bureau of Investigation (FBI), CISA, and NSA are releasing this joint Cybersecurity Advisory to provide a fictional, educational overview of APT activity observed in training scenarios. CrimsonViper actors likely conduct reconnaissance by gathering information on network trust dependencies [T1590.003] through spear-phishing campaigns targeting administrators with fake security audit requests. They employed spearphishing services [T1598.001] via Outlook.com to distribute malicious emails containing credential harvesting links while simultaneously using spearphishing links [T1566.002] to deliver .hta files that executed payloads. In one incident, a USB Rubber Ducky was utilized for hardware additions [T1200] to establish remote access, and data from removable media [T1025] was collected using the FunnyDream FilePakMonitor component. The attackers leveraged Dynamic Data Exchange [T1559.002] in phishing documents to run system commands without user interaction and implemented debugger evasion [T1622] by using the CheckRemoteDebuggerPresent function to detect debuggers. For data collection, they queried Confluence repositories [T1213.001] for API documentation and used git submodule initialization [T1213.003] to download proprietary libraries from private code repositories. Additionally, the botnet controller employed fast flux DNS [T1568.001] by de-registering DNS A records for domains flagged by security vendors. System logs from the targeted organization, 'SecureCorp Inc.', a mid-sized energy provider, showed normal authentication events during the attack, with no immediate alerts triggered. The company's background includes recent mergers, but this information is unrelated to the intrusion. Network traffic analysis revealed benign HTTP requests to internal servers, which were not part of the malicious activity.",
        "techniques_used": [
            "T1590.003",
            "T1598.001",
            "T1200",
            "T1566.002",
            "T1559.002",
            "T1622",
            "T1025",
            "T1213.001",
            "T1213.003",
            "T1568.001"
        ]
    }
}