{
    "report_id": "report_627",
    "generated_at": "20251222_170905",
    "scenario_target_ids": [
        "T1583.003",
        "T1608.006",
        "T1608.003",
        "T1566",
        "T1129",
        "T1027",
        "T1036.001",
        "T1553.006",
        "T1087.004",
        "T1568.003",
        "T1011.001"
    ],
    "scenario_flow": [
        "resource-development",
        "resource-development",
        "resource-development",
        "initial-access",
        "execution",
        "defense-evasion",
        "defense-evasion",
        "defense-evasion",
        "discovery",
        "command-and-control",
        "exfiltration"
    ],
    "llm_declared_ids": [
        "T1583.003",
        "T1608.006",
        "T1608.003",
        "T1566",
        "T1129",
        "T1027",
        "T1036.001",
        "T1553.006",
        "T1087.004",
        "T1568.003",
        "T1011.001"
    ],
    "actual_found_ids": [
        "T1129",
        "T1011.001",
        "T1608.003",
        "T1566",
        "T1583.003",
        "T1027",
        "T1568.003",
        "T1608.006",
        "T1087.004",
        "T1036.001",
        "T1553.006"
    ],
    "clean_text": "**Background and Initial Access**\nOn March 15, 2024, security analysts at a fictional energy company, 'GridSecure Inc.', detected anomalous network traffic originating from external IP addresses. GridSecure Inc., a mid-sized provider operating in the U.S. with 500 employees, reported unusual spikes in DNS queries during routine log analysis at 14:30 UTC. The actors likely established infrastructure by provisioning virtual private servers (VPS) from commercial hosting providers to host malicious domains, which were then optimized for search engine poisoning to lure victims via compromised websites with hidden text. Initial access was achieved through a phishing campaign where employees received emails with ISO attachments disguised as invoices, containing executable payloads that, when mounted, installed a digital certificate by modifying the Apache httpd.conf file to include 'SSLCertificateFile /opt/malware/cert.pem' for SSL/TLS encryption of command-and-control (C2) traffic.\n\n**Execution and Persistence**\nUpon execution, the malware leveraged shared modules using the Java Instrumentation API and Javassist to dynamically modify Java code in memory, while simultaneously obfuscating files with ConfuserEx features encoded in base64 strings to evade detection. System logs from GridSecure's Windows servers showed failed attempts to access 'regedit.exe' at 15:45 UTC, though this was unrelated. To maintain persistence, the actors employed invalid code signatures by modifying an unsigned 'regedit.exe' to add malicious functionality and bypassed security policies through code signing policy modification using CVE-2017-15303 to disable Windows Driver Signature Enforcement (DSE) and load a malicious driver.\n\n**Privilege Escalation and Discovery**\nAfter gaining a foothold, the malware escalated privileges by executing a PowerShell script that enumerated cloud accounts with 'Get-MsolRoleMember.ps1' to list members of administrative roles in Microsoft 365, while also using DNS calculation with iodine to tunnel TCP traffic through DNS queries and bypass network filtering. Internal network scans revealed increased Bluetooth activity on infected endpoints, though initial assessments attributed this to employee devices; further investigation confirmed exfiltration over Bluetooth where hackers exploited Bluetooth HID protocol weaknesses to exfiltrate keystroke logs from compromised systems.\n\n**Impact and Recommendations**\nThis fictional campaign resulted in the exfiltration of sensitive operational data from GridSecure Inc., highlighting the need for enhanced monitoring of external infrastructure, email filtering, and network segmentation. Blue teams should implement strict code signing policies, monitor for unusual DNS and Bluetooth traffic, and conduct regular security awareness training to mitigate similar threats.",
    "tagged_text": "**Background and Initial Access**\nOn March 15, 2024, security analysts at a fictional energy company, 'GridSecure Inc.', detected anomalous network traffic originating from external IP addresses. GridSecure Inc., a mid-sized provider operating in the U.S. with 500 employees, reported unusual spikes in DNS queries during routine log analysis at 14:30 UTC. The actors likely established infrastructure by provisioning virtual private servers (VPS) [T1583.003] from commercial hosting providers to host malicious domains, which were then optimized for search engine poisoning [T1608.006] to lure victims via compromised websites with hidden text. Initial access was achieved through a phishing campaign [T1566] where employees received emails with ISO attachments disguised as invoices, containing executable payloads that, when mounted, installed a digital certificate [T1608.003] by modifying the Apache httpd.conf file to include 'SSLCertificateFile /opt/malware/cert.pem' for SSL/TLS encryption of command-and-control (C2) traffic.\n\n**Execution and Persistence**\nUpon execution, the malware leveraged shared modules [T1129] using the Java Instrumentation API and Javassist to dynamically modify Java code in memory, while simultaneously obfuscating files [T1027] with ConfuserEx features encoded in base64 strings to evade detection. System logs from GridSecure's Windows servers showed failed attempts to access 'regedit.exe' at 15:45 UTC, though this was unrelated. To maintain persistence, the actors employed invalid code signatures [T1036.001] by modifying an unsigned 'regedit.exe' to add malicious functionality and bypassed security policies through code signing policy modification [T1553.006] using CVE-2017-15303 to disable Windows Driver Signature Enforcement (DSE) and load a malicious driver.\n\n**Privilege Escalation and Discovery**\nAfter gaining a foothold, the malware escalated privileges by executing a PowerShell script that enumerated cloud accounts [T1087.004] with 'Get-MsolRoleMember.ps1' to list members of administrative roles in Microsoft 365, while also using DNS calculation [T1568.003] with iodine to tunnel TCP traffic through DNS queries and bypass network filtering. Internal network scans revealed increased Bluetooth activity on infected endpoints, though initial assessments attributed this to employee devices; further investigation confirmed exfiltration over Bluetooth [T1011.001] where hackers exploited Bluetooth HID protocol weaknesses to exfiltrate keystroke logs from compromised systems.\n\n**Impact and Recommendations**\nThis fictional campaign resulted in the exfiltration of sensitive operational data from GridSecure Inc., highlighting the need for enhanced monitoring of external infrastructure, email filtering, and network segmentation. Blue teams should implement strict code signing policies, monitor for unusual DNS and Bluetooth traffic, and conduct regular security awareness training to mitigate similar threats.",
    "sentence_annotations": [
        {
            "sentence": "Initial access was achieved through a phishing campaign where employees received emails with ISO attachments disguised as invoices, containing executable payloads that, when mounted, installed a digital certificate [T1608.",
            "technique_id": "T1566",
            "technique_name": "Phishing"
        },
        {
            "sentence": "**Execution and Persistence**\nUpon execution, the malware leveraged shared modules using the Java Instrumentation API and Javassist to dynamically modify Java code in memory, while simultaneously obfuscating files with ConfuserEx features encoded in base64 strings to evade detection.",
            "technique_id": "T1129",
            "technique_name": "Shared Modules"
        },
        {
            "sentence": "**Execution and Persistence**\nUpon execution, the malware leveraged shared modules using the Java Instrumentation API and Javassist to dynamically modify Java code in memory, while simultaneously obfuscating files with ConfuserEx features encoded in base64 strings to evade detection.",
            "technique_id": "T1027",
            "technique_name": "Obfuscated Files or Information"
        }
    ],
    "llm_raw_response": {
        "title": "Joint Cybersecurity Advisory: Fictional APT Campaign 'ShadowVeil' Targeting Critical Infrastructure",
        "summary": "This advisory details a simulated campaign by a fictional advanced persistent threat (APT) group, designated 'ShadowVeil', targeting critical infrastructure sectors. The campaign employs sophisticated techniques across the cyber kill-chain, including infrastructure setup, phishing, obfuscation, privilege escalation, and exfiltration, to compromise networks and exfiltrate sensitive data. Blue teams are advised to review defenses against these tactics.",
        "full_report_text": "**Background and Initial Access**\nOn March 15, 2024, security analysts at a fictional energy company, 'GridSecure Inc.', detected anomalous network traffic originating from external IP addresses. GridSecure Inc., a mid-sized provider operating in the U.S. with 500 employees, reported unusual spikes in DNS queries during routine log analysis at 14:30 UTC. The actors likely established infrastructure by provisioning virtual private servers (VPS) [T1583.003] from commercial hosting providers to host malicious domains, which were then optimized for search engine poisoning [T1608.006] to lure victims via compromised websites with hidden text. Initial access was achieved through a phishing campaign [T1566] where employees received emails with ISO attachments disguised as invoices, containing executable payloads that, when mounted, installed a digital certificate [T1608.003] by modifying the Apache httpd.conf file to include 'SSLCertificateFile /opt/malware/cert.pem' for SSL/TLS encryption of command-and-control (C2) traffic.\n\n**Execution and Persistence**\nUpon execution, the malware leveraged shared modules [T1129] using the Java Instrumentation API and Javassist to dynamically modify Java code in memory, while simultaneously obfuscating files [T1027] with ConfuserEx features encoded in base64 strings to evade detection. System logs from GridSecure's Windows servers showed failed attempts to access 'regedit.exe' at 15:45 UTC, though this was unrelated. To maintain persistence, the actors employed invalid code signatures [T1036.001] by modifying an unsigned 'regedit.exe' to add malicious functionality and bypassed security policies through code signing policy modification [T1553.006] using CVE-2017-15303 to disable Windows Driver Signature Enforcement (DSE) and load a malicious driver.\n\n**Privilege Escalation and Discovery**\nAfter gaining a foothold, the malware escalated privileges by executing a PowerShell script that enumerated cloud accounts [T1087.004] with 'Get-MsolRoleMember.ps1' to list members of administrative roles in Microsoft 365, while also using DNS calculation [T1568.003] with iodine to tunnel TCP traffic through DNS queries and bypass network filtering. Internal network scans revealed increased Bluetooth activity on infected endpoints, though initial assessments attributed this to employee devices; further investigation confirmed exfiltration over Bluetooth [T1011.001] where hackers exploited Bluetooth HID protocol weaknesses to exfiltrate keystroke logs from compromised systems.\n\n**Impact and Recommendations**\nThis fictional campaign resulted in the exfiltration of sensitive operational data from GridSecure Inc., highlighting the need for enhanced monitoring of external infrastructure, email filtering, and network segmentation. Blue teams should implement strict code signing policies, monitor for unusual DNS and Bluetooth traffic, and conduct regular security awareness training to mitigate similar threats.",
        "techniques_used": [
            "T1583.003",
            "T1608.006",
            "T1608.003",
            "T1566",
            "T1129",
            "T1027",
            "T1036.001",
            "T1553.006",
            "T1087.004",
            "T1568.003",
            "T1011.001"
        ]
    }
}