{
    "report_id": "report_210",
    "generated_at": "20251222_141114",
    "scenario_target_ids": [
        "T1584.006",
        "T1584",
        "T1566",
        "T1566.004",
        "T1675",
        "T1556",
        "T1558.001",
        "T1602",
        "T1056.001",
        "T1102.001",
        "T1048.001",
        "T1537",
        "T1565.003"
    ],
    "scenario_flow": [
        "resource-development",
        "resource-development",
        "initial-access",
        "initial-access",
        "execution",
        "credential-access",
        "credential-access",
        "collection",
        "collection",
        "command-and-control",
        "exfiltration",
        "exfiltration",
        "impact"
    ],
    "llm_declared_ids": [
        "T1584.006",
        "T1584",
        "T1566",
        "T1566.004",
        "T1675",
        "T1556",
        "T1558.001",
        "T1602",
        "T1056.001",
        "T1102.001",
        "T1048.001",
        "T1537",
        "T1565.003"
    ],
    "actual_found_ids": [
        "T1048.001",
        "T1102.001",
        "T1566.004",
        "T1056.001",
        "T1556",
        "T1565.003",
        "T1566",
        "T1602",
        "T1584.006",
        "T1584",
        "T1675",
        "T1558.001",
        "T1537"
    ],
    "clean_text": "The Federal Bureau of Investigation (FBI), CISA, and NSA are releasing this joint Cybersecurity Advisory to provide a fictional, educational overview of the 'ShadowVeil' campaign, which has been observed targeting organizations in the energy and healthcare sectors since early 2024. This report is based on simulated incident response data and is designed for training purposes to help defenders identify and mitigate advanced threats.\n\nInitial Access: The actors likely conducted reconnaissance by compromising a DNS server to redirect legitimate domain queries to attacker-controlled IP addresses, and they used Twitter polls as a covert signaling mechanism to activate dormant systems within the network. Subsequently, they initiated phishing campaigns, sending emails with password-protected ZIP files containing trojanized executables to bypass email security filters, while also employing spearphishing voice calls where they impersonated IT support personnel to direct victims to download a malicious remote monitoring and management (RMM) tool for initial access.\n\nExecution: Upon execution, the malware abused the vSphere Web Services SDK to run ESXi administration commands, establishing persistence on virtualized guest operating systems, and it exploited a vulnerability to gain SYSTEM privileges, directly modifying the LSASS process to alter authentication mechanisms. The adversary then forged a golden ticket using the stolen KRBTGT password hash, setting it with a 10-year validity to maintain long-term access.\n\nPersistence and Discovery: To gather additional intelligence, the actors used scripts to query SMB shares across the network, searching for administrative configuration files to identify sensitive data and system configurations, and they deployed a keylogging component to capture keystrokes from compromised systems, enabling credential theft.\n\nCommand and Control: For covert communication, the malware employed a dead drop resolver technique, hiding base64-encoded and encrypted command-and-control server locations within comments on legitimate websites to evade detection.\n\nExfiltration: The threat actor utilized RC4 encryption on harvested intellectual property before exfiltrating it via FTP over symmetric encrypted non-C2 protocols to bypass network monitoring, and they transferred the encrypted data to a cloud account using Google Cloud Storage services to move it to their own GCP project for further analysis.\n\nImpact: In the final stage, the spyware modified a legitimate application executable to display a fake login screen at runtime, capturing user credentials through data manipulation. System logs from affected organizations showed unusual network traffic spikes and failed authentication attempts, though these were not directly linked to the techniques used. The campaign resulted in simulated data breaches and operational disruptions, highlighting the need for robust endpoint detection and multi-factor authentication.\n\nRecommendations: Organizations are advised to implement network segmentation, monitor for anomalous DNS queries and social engineering attempts, and conduct regular security awareness training. This fictional scenario underscores the importance of proactive threat hunting and incident response planning.",
    "tagged_text": "The Federal Bureau of Investigation (FBI), CISA, and NSA are releasing this joint Cybersecurity Advisory to provide a fictional, educational overview of the 'ShadowVeil' campaign, which has been observed targeting organizations in the energy and healthcare sectors since early 2024. This report is based on simulated incident response data and is designed for training purposes to help defenders identify and mitigate advanced threats.\n\nInitial Access: The actors likely conducted reconnaissance by compromising a DNS server to redirect legitimate domain queries to attacker-controlled IP addresses [T1584], and they used Twitter polls as a covert signaling mechanism to activate dormant systems within the network [T1584.006]. Subsequently, they initiated phishing campaigns, sending emails with password-protected ZIP files containing trojanized executables to bypass email security filters [T1566], while also employing spearphishing voice calls where they impersonated IT support personnel to direct victims to download a malicious remote monitoring and management (RMM) tool for initial access [T1566.004].\n\nExecution: Upon execution, the malware abused the vSphere Web Services SDK to run ESXi administration commands, establishing persistence on virtualized guest operating systems [T1675], and it exploited a vulnerability to gain SYSTEM privileges, directly modifying the LSASS process to alter authentication mechanisms [T1556]. The adversary then forged a golden ticket using the stolen KRBTGT password hash, setting it with a 10-year validity to maintain long-term access [T1558.001].\n\nPersistence and Discovery: To gather additional intelligence, the actors used scripts to query SMB shares across the network, searching for administrative configuration files to identify sensitive data and system configurations [T1602], and they deployed a keylogging component to capture keystrokes from compromised systems, enabling credential theft [T1056.001].\n\nCommand and Control: For covert communication, the malware employed a dead drop resolver technique, hiding base64-encoded and encrypted command-and-control server locations within comments on legitimate websites to evade detection [T1102.001].\n\nExfiltration: The threat actor utilized RC4 encryption on harvested intellectual property before exfiltrating it via FTP over symmetric encrypted non-C2 protocols to bypass network monitoring [T1048.001], and they transferred the encrypted data to a cloud account using Google Cloud Storage services to move it to their own GCP project for further analysis [T1537].\n\nImpact: In the final stage, the spyware modified a legitimate application executable to display a fake login screen at runtime, capturing user credentials through data manipulation [T1565.003]. System logs from affected organizations showed unusual network traffic spikes and failed authentication attempts, though these were not directly linked to the techniques used. The campaign resulted in simulated data breaches and operational disruptions, highlighting the need for robust endpoint detection and multi-factor authentication.\n\nRecommendations: Organizations are advised to implement network segmentation, monitor for anomalous DNS queries and social engineering attempts, and conduct regular security awareness training. This fictional scenario underscores the importance of proactive threat hunting and incident response planning.",
    "sentence_annotations": [
        {
            "sentence": "Initial Access: The actors likely conducted reconnaissance by compromising a DNS server to redirect legitimate domain queries to attacker-controlled IP addresses, and they used Twitter polls as a covert signaling mechanism to activate dormant systems within the network [T1584.",
            "technique_id": "T1584",
            "technique_name": "Compromise Infrastructure"
        },
        {
            "sentence": "Subsequently, they initiated phishing campaigns, sending emails with password-protected ZIP files containing trojanized executables to bypass email security filters, while also employing spearphishing voice calls where they impersonated IT support personnel to direct victims to download a malicious remote monitoring and management (RMM) tool for initial access [T1566.",
            "technique_id": "T1566",
            "technique_name": "Phishing"
        },
        {
            "sentence": "Execution: Upon execution, the malware abused the vSphere Web Services SDK to run ESXi administration commands, establishing persistence on virtualized guest operating systems, and it exploited a vulnerability to gain SYSTEM privileges, directly modifying the LSASS process to alter authentication mechanisms.",
            "technique_id": "T1675",
            "technique_name": "ESXi Administration Command"
        },
        {
            "sentence": "Execution: Upon execution, the malware abused the vSphere Web Services SDK to run ESXi administration commands, establishing persistence on virtualized guest operating systems, and it exploited a vulnerability to gain SYSTEM privileges, directly modifying the LSASS process to alter authentication mechanisms.",
            "technique_id": "T1556",
            "technique_name": "Modify Authentication Process"
        },
        {
            "sentence": "Persistence and Discovery: To gather additional intelligence, the actors used scripts to query SMB shares across the network, searching for administrative configuration files to identify sensitive data and system configurations, and they deployed a keylogging component to capture keystrokes from compromised systems, enabling credential theft [T1056.",
            "technique_id": "T1602",
            "technique_name": "Data from Configuration Repository"
        },
        {
            "sentence": "001], and they transferred the encrypted data to a cloud account using Google Cloud Storage services to move it to their own GCP project for further analysis.",
            "technique_id": "T1537",
            "technique_name": "Transfer Data to Cloud Account"
        }
    ],
    "llm_raw_response": {
        "title": "Joint Cybersecurity Advisory: Fictional APT Campaign 'ShadowVeil' Targeting Critical Infrastructure",
        "summary": "This advisory details a simulated campaign by the fictional threat actor 'ShadowVeil' targeting critical infrastructure sectors, leveraging compromised infrastructure, social engineering, and credential theft to achieve persistence and exfiltration. The report is intended for blue team training to enhance detection and response capabilities against multi-stage attacks.",
        "full_report_text": "The Federal Bureau of Investigation (FBI), CISA, and NSA are releasing this joint Cybersecurity Advisory to provide a fictional, educational overview of the 'ShadowVeil' campaign, which has been observed targeting organizations in the energy and healthcare sectors since early 2024. This report is based on simulated incident response data and is designed for training purposes to help defenders identify and mitigate advanced threats.\n\nInitial Access: The actors likely conducted reconnaissance by compromising a DNS server to redirect legitimate domain queries to attacker-controlled IP addresses [T1584], and they used Twitter polls as a covert signaling mechanism to activate dormant systems within the network [T1584.006]. Subsequently, they initiated phishing campaigns, sending emails with password-protected ZIP files containing trojanized executables to bypass email security filters [T1566], while also employing spearphishing voice calls where they impersonated IT support personnel to direct victims to download a malicious remote monitoring and management (RMM) tool for initial access [T1566.004].\n\nExecution: Upon execution, the malware abused the vSphere Web Services SDK to run ESXi administration commands, establishing persistence on virtualized guest operating systems [T1675], and it exploited a vulnerability to gain SYSTEM privileges, directly modifying the LSASS process to alter authentication mechanisms [T1556]. The adversary then forged a golden ticket using the stolen KRBTGT password hash, setting it with a 10-year validity to maintain long-term access [T1558.001].\n\nPersistence and Discovery: To gather additional intelligence, the actors used scripts to query SMB shares across the network, searching for administrative configuration files to identify sensitive data and system configurations [T1602], and they deployed a keylogging component to capture keystrokes from compromised systems, enabling credential theft [T1056.001].\n\nCommand and Control: For covert communication, the malware employed a dead drop resolver technique, hiding base64-encoded and encrypted command-and-control server locations within comments on legitimate websites to evade detection [T1102.001].\n\nExfiltration: The threat actor utilized RC4 encryption on harvested intellectual property before exfiltrating it via FTP over symmetric encrypted non-C2 protocols to bypass network monitoring [T1048.001], and they transferred the encrypted data to a cloud account using Google Cloud Storage services to move it to their own GCP project for further analysis [T1537].\n\nImpact: In the final stage, the spyware modified a legitimate application executable to display a fake login screen at runtime, capturing user credentials through data manipulation [T1565.003]. System logs from affected organizations showed unusual network traffic spikes and failed authentication attempts, though these were not directly linked to the techniques used. The campaign resulted in simulated data breaches and operational disruptions, highlighting the need for robust endpoint detection and multi-factor authentication.\n\nRecommendations: Organizations are advised to implement network segmentation, monitor for anomalous DNS queries and social engineering attempts, and conduct regular security awareness training. This fictional scenario underscores the importance of proactive threat hunting and incident response planning.",
        "techniques_used": [
            "T1584.006",
            "T1584",
            "T1566",
            "T1566.004",
            "T1675",
            "T1556",
            "T1558.001",
            "T1602",
            "T1056.001",
            "T1102.001",
            "T1048.001",
            "T1537",
            "T1565.003"
        ]
    }
}