{
    "report_id": "report_677",
    "generated_at": "20251222_172833",
    "scenario_target_ids": [
        "T1589",
        "T1595.003",
        "T1592",
        "T1200",
        "T1566",
        "T1569.002",
        "T1074.001",
        "T1090.004"
    ],
    "scenario_flow": [
        "reconnaissance",
        "reconnaissance",
        "reconnaissance",
        "initial-access",
        "initial-access",
        "execution",
        "collection",
        "command-and-control"
    ],
    "llm_declared_ids": [
        "T1589",
        "T1595.003",
        "T1592",
        "T1200",
        "T1566",
        "T1569.002",
        "T1074.001",
        "T1090.004"
    ],
    "actual_found_ids": [
        "T1592",
        "T1595.003",
        "T1074.001",
        "T1589",
        "T1200",
        "T1569.002",
        "T1566",
        "T1090.004"
    ],
    "clean_text": "Crimson Tempest, a simulated APT group, initiated operations by conducting reconnaissance to gather victim identity information, focusing on employees of a fictional energy company, 'VoltGrid Inc.', through social media and professional networks to identify key personnel. Concurrently, the actors performed wordlist scanning against VoltGrid's external web servers using tools like DirBuster to discover exposed administrative interfaces, while also injecting malicious JavaScript into compromised websites to gather victim host information from visitors, exploiting browser vulnerabilities to collect system details. In a physical breach, adversaries deployed hardware additions by covertly connecting Bash Bunny devices to internal network ports in VoltGrid's office, enabling local network access. This was complemented by a phishing campaign that distributed emails with password-protected ZIP attachments containing malware, targeting employees identified during reconnaissance. Upon execution, the malware leveraged service execution via PsExec to propagate across the network, while staging local data by gathering host information and compressing it into encrypted RAR files stored at %TEMP%/TS_FB56.tmp. For exfiltration, the actors used domain fronting by modifying HTTP Accept headers to conceal TLS-encrypted traffic destinations, routing data through legitimate cloud services. System logs from VoltGrid's SIEM showed anomalous spikes in network traffic at 03:00 UTC, but initial alerts were dismissed as false positives due to routine maintenance schedules. The company's background includes operations in renewable energy across North America, with no prior major security incidents reported.",
    "tagged_text": "Crimson Tempest, a simulated APT group, initiated operations by conducting reconnaissance to gather victim identity information [T1589], focusing on employees of a fictional energy company, 'VoltGrid Inc.', through social media and professional networks to identify key personnel. Concurrently, the actors performed wordlist scanning [T1595.003] against VoltGrid's external web servers using tools like DirBuster to discover exposed administrative interfaces, while also injecting malicious JavaScript into compromised websites to gather victim host information [T1592] from visitors, exploiting browser vulnerabilities to collect system details. In a physical breach, adversaries deployed hardware additions [T1200] by covertly connecting Bash Bunny devices to internal network ports in VoltGrid's office, enabling local network access. This was complemented by a phishing campaign [T1566] that distributed emails with password-protected ZIP attachments containing malware, targeting employees identified during reconnaissance. Upon execution, the malware leveraged service execution [T1569.002] via PsExec to propagate across the network, while staging local data [T1074.001] by gathering host information and compressing it into encrypted RAR files stored at %TEMP%/TS_FB56.tmp. For exfiltration, the actors used domain fronting [T1090.004] by modifying HTTP Accept headers to conceal TLS-encrypted traffic destinations, routing data through legitimate cloud services. System logs from VoltGrid's SIEM showed anomalous spikes in network traffic at 03:00 UTC, but initial alerts were dismissed as false positives due to routine maintenance schedules. The company's background includes operations in renewable energy across North America, with no prior major security incidents reported.",
    "sentence_annotations": [
        {
            "sentence": "Crimson Tempest, a simulated APT group, initiated operations by conducting reconnaissance to gather victim identity information, focusing on employees of a fictional energy company, 'VoltGrid Inc.",
            "technique_id": "T1589",
            "technique_name": "Gather Victim Identity Information"
        },
        {
            "sentence": "003] against VoltGrid's external web servers using tools like DirBuster to discover exposed administrative interfaces, while also injecting malicious JavaScript into compromised websites to gather victim host information from visitors, exploiting browser vulnerabilities to collect system details.",
            "technique_id": "T1592",
            "technique_name": "Gather Victim Host Information"
        },
        {
            "sentence": "In a physical breach, adversaries deployed hardware additions by covertly connecting Bash Bunny devices to internal network ports in VoltGrid's office, enabling local network access.",
            "technique_id": "T1200",
            "technique_name": "Hardware Additions"
        },
        {
            "sentence": "This was complemented by a phishing campaign that distributed emails with password-protected ZIP attachments containing malware, targeting employees identified during reconnaissance.",
            "technique_id": "T1566",
            "technique_name": "Phishing"
        }
    ],
    "llm_raw_response": {
        "title": "Joint Cybersecurity Advisory: Simulated APT Campaign Targeting Critical Infrastructure",
        "summary": "This advisory details a fictional campaign by a simulated advanced persistent threat (APT) group, designated 'Crimson Tempest', targeting critical infrastructure sectors. The campaign employs a multi-vector approach, blending social engineering, physical access, and network exploitation to compromise systems and exfiltrate data. This report is for blue team training purposes to enhance detection and response capabilities against such tactics.",
        "full_report_text": "Crimson Tempest, a simulated APT group, initiated operations by conducting reconnaissance to gather victim identity information [T1589], focusing on employees of a fictional energy company, 'VoltGrid Inc.', through social media and professional networks to identify key personnel. Concurrently, the actors performed wordlist scanning [T1595.003] against VoltGrid's external web servers using tools like DirBuster to discover exposed administrative interfaces, while also injecting malicious JavaScript into compromised websites to gather victim host information [T1592] from visitors, exploiting browser vulnerabilities to collect system details. In a physical breach, adversaries deployed hardware additions [T1200] by covertly connecting Bash Bunny devices to internal network ports in VoltGrid's office, enabling local network access. This was complemented by a phishing campaign [T1566] that distributed emails with password-protected ZIP attachments containing malware, targeting employees identified during reconnaissance. Upon execution, the malware leveraged service execution [T1569.002] via PsExec to propagate across the network, while staging local data [T1074.001] by gathering host information and compressing it into encrypted RAR files stored at %TEMP%/TS_FB56.tmp. For exfiltration, the actors used domain fronting [T1090.004] by modifying HTTP Accept headers to conceal TLS-encrypted traffic destinations, routing data through legitimate cloud services. System logs from VoltGrid's SIEM showed anomalous spikes in network traffic at 03:00 UTC, but initial alerts were dismissed as false positives due to routine maintenance schedules. The company's background includes operations in renewable energy across North America, with no prior major security incidents reported.",
        "techniques_used": [
            "T1589",
            "T1595.003",
            "T1592",
            "T1200",
            "T1566",
            "T1569.002",
            "T1074.001",
            "T1090.004"
        ]
    }
}