{
    "report_id": "report_543",
    "generated_at": "20251222_163346",
    "scenario_target_ids": [
        "T1566.003",
        "T1559.001",
        "T1556.002",
        "T1550.004",
        "T1072",
        "T1213.002",
        "T1205"
    ],
    "scenario_flow": [
        "initial-access",
        "execution",
        "persistence",
        "lateral-movement",
        "lateral-movement",
        "collection",
        "command-and-control"
    ],
    "llm_declared_ids": [
        "T1566.003",
        "T1559.001",
        "T1556.002",
        "T1550.004",
        "T1072",
        "T1213.002",
        "T1205"
    ],
    "actual_found_ids": [
        "T1072",
        "T1205",
        "T1550.004",
        "T1559.001",
        "T1213.002",
        "T1566.003",
        "T1556.002"
    ],
    "clean_text": "Storm-1811, a fictional advanced persistent threat group, has been observed targeting large enterprises in the financial and technology sectors. The attack began with reconnaissance, where actors gathered employee information from public sources like LinkedIn and company websites, though no specific technique tags apply to this generic activity. Initial access was achieved through spearphishing via Microsoft Teams, where the actors posed as IT support personnel to send malicious links, initiating voice calls to increase credibility. Upon execution, the adversary employed Component Object Model (COM) objects to create scheduled tasks for persistence while simultaneously deploying a Password Filter DLL that monitored credential input fields across applications, logging keystrokes to capture domain admin passwords. System logs from the victim's Windows Event Viewer showed unusual process creations at 03:14:22 UTC, but these were not directly tied to tagged techniques. For credential access, the actors collected web session cookies from browser storage to bypass multi-factor authentication, enabling unauthorized access to cloud services. Lateral movement was facilitated using Software Deployment Tools like SCCM to deploy a malicious Group Policy Object that executed commands on all domain computers, while also leveraging SharePoint permissions to access and exfiltrate customer databases stored in collaborative platforms. The company, a mid-sized tech firm with offices in New York and London, reported network slowdowns during peak hours, unrelated to the attack. For command and control, the threat actor implemented traffic signaling by using libpcap to monitor for specific traffic patterns that would activate normally dormant malicious ports, ensuring stealthy communication. Exfiltration occurred over encrypted channels, with data masked as routine backup traffic, though no additional techniques were tagged in this phase. The attack concluded with the actors covering tracks by deleting logs and using legitimate admin tools, highlighting the need for robust monitoring and response protocols.",
    "tagged_text": "Storm-1811, a fictional advanced persistent threat group, has been observed targeting large enterprises in the financial and technology sectors. The attack began with reconnaissance, where actors gathered employee information from public sources like LinkedIn and company websites, though no specific technique tags apply to this generic activity. Initial access was achieved through spearphishing via Microsoft Teams [T1566.003], where the actors posed as IT support personnel to send malicious links, initiating voice calls to increase credibility. Upon execution, the adversary employed Component Object Model (COM) objects [T1559.001] to create scheduled tasks for persistence while simultaneously deploying a Password Filter DLL [T1556.002] that monitored credential input fields across applications, logging keystrokes to capture domain admin passwords. System logs from the victim's Windows Event Viewer showed unusual process creations at 03:14:22 UTC, but these were not directly tied to tagged techniques. For credential access, the actors collected web session cookies [T1550.004] from browser storage to bypass multi-factor authentication, enabling unauthorized access to cloud services. Lateral movement was facilitated using Software Deployment Tools like SCCM [T1072] to deploy a malicious Group Policy Object that executed commands on all domain computers, while also leveraging SharePoint permissions [T1213.002] to access and exfiltrate customer databases stored in collaborative platforms. The company, a mid-sized tech firm with offices in New York and London, reported network slowdowns during peak hours, unrelated to the attack. For command and control, the threat actor implemented traffic signaling [T1205] by using libpcap to monitor for specific traffic patterns that would activate normally dormant malicious ports, ensuring stealthy communication. Exfiltration occurred over encrypted channels, with data masked as routine backup traffic, though no additional techniques were tagged in this phase. The attack concluded with the actors covering tracks by deleting logs and using legitimate admin tools, highlighting the need for robust monitoring and response protocols.",
    "sentence_annotations": [
        {
            "sentence": "Lateral movement was facilitated using Software Deployment Tools like SCCM to deploy a malicious Group Policy Object that executed commands on all domain computers, while also leveraging SharePoint permissions [T1213.",
            "technique_id": "T1072",
            "technique_name": "Software Deployment Tools"
        },
        {
            "sentence": "For command and control, the threat actor implemented traffic signaling by using libpcap to monitor for specific traffic patterns that would activate normally dormant malicious ports, ensuring stealthy communication.",
            "technique_id": "T1205",
            "technique_name": "Traffic Signaling"
        }
    ],
    "llm_raw_response": {
        "title": "Joint Cybersecurity Advisory: Fictional APT Campaign 'Storm-1811' Targeting Enterprise Networks",
        "summary": "The Federal Bureau of Investigation (FBI), CISA, and NSA are releasing this joint Cybersecurity Advisory to detail a simulated, sophisticated campaign by the fictional threat actor Storm-1811. This report, intended for blue team training, describes a multi-stage attack leveraging social engineering, credential theft, and lateral movement to compromise sensitive data. The scenario includes realistic noise elements to enhance detection training.",
        "full_report_text": "Storm-1811, a fictional advanced persistent threat group, has been observed targeting large enterprises in the financial and technology sectors. The attack began with reconnaissance, where actors gathered employee information from public sources like LinkedIn and company websites, though no specific technique tags apply to this generic activity. Initial access was achieved through spearphishing via Microsoft Teams [T1566.003], where the actors posed as IT support personnel to send malicious links, initiating voice calls to increase credibility. Upon execution, the adversary employed Component Object Model (COM) objects [T1559.001] to create scheduled tasks for persistence while simultaneously deploying a Password Filter DLL [T1556.002] that monitored credential input fields across applications, logging keystrokes to capture domain admin passwords. System logs from the victim's Windows Event Viewer showed unusual process creations at 03:14:22 UTC, but these were not directly tied to tagged techniques. For credential access, the actors collected web session cookies [T1550.004] from browser storage to bypass multi-factor authentication, enabling unauthorized access to cloud services. Lateral movement was facilitated using Software Deployment Tools like SCCM [T1072] to deploy a malicious Group Policy Object that executed commands on all domain computers, while also leveraging SharePoint permissions [T1213.002] to access and exfiltrate customer databases stored in collaborative platforms. The company, a mid-sized tech firm with offices in New York and London, reported network slowdowns during peak hours, unrelated to the attack. For command and control, the threat actor implemented traffic signaling [T1205] by using libpcap to monitor for specific traffic patterns that would activate normally dormant malicious ports, ensuring stealthy communication. Exfiltration occurred over encrypted channels, with data masked as routine backup traffic, though no additional techniques were tagged in this phase. The attack concluded with the actors covering tracks by deleting logs and using legitimate admin tools, highlighting the need for robust monitoring and response protocols.",
        "techniques_used": [
            "T1566.003",
            "T1559.001",
            "T1556.002",
            "T1550.004",
            "T1072",
            "T1213.002",
            "T1205"
        ]
    }
}