{
    "report_id": "report_357",
    "generated_at": "20251222_151229",
    "scenario_target_ids": [
        "T1566",
        "T1195.002",
        "T1059.003",
        "T1546.004",
        "T1578.001",
        "T1218.001",
        "T1027.012",
        "T1555.006",
        "T1556",
        "T1205.001",
        "T1011.001"
    ],
    "scenario_flow": [
        "initial-access",
        "initial-access",
        "execution",
        "persistence",
        "defense-evasion",
        "defense-evasion",
        "defense-evasion",
        "credential-access",
        "credential-access",
        "command-and-control",
        "exfiltration"
    ],
    "llm_declared_ids": [
        "T1566",
        "T1195.002",
        "T1059.003",
        "T1546.004",
        "T1578.001",
        "T1218.001",
        "T1027.012",
        "T1555.006",
        "T1556",
        "T1205.001",
        "T1011.001"
    ],
    "actual_found_ids": [
        "T1195.002",
        "T1011.001",
        "T1059.003",
        "T1555.006",
        "T1218.001",
        "T1546.004",
        "T1205.001",
        "T1578.001",
        "T1566",
        "T1027.012",
        "T1556"
    ],
    "clean_text": "### Attack Narrative and Kill-Chain Analysis\n\n**Initial Access:** The campaign began with targeted phishing emails sent to employees at a fictional financial firm, 'SecureBank Inc.', which included password-protected ZIP files containing trojanized executables designed to mimic legitimate software updates. Concurrently, the actors compromised a third-party software repository used by 'SecureBank' for internal tools, substituting the authentic release package with a maliciously modified executable that was distributed via automated update mechanisms.\n\n**Execution:** Upon execution, the malware dropped a malicious CHM file named 'help.chm' into the temp directory and employed Windows Command Shell to execute cmd.exe, providing a reverse shell to adversaries while simultaneously modifying the malicious.lnk file to include obfuscated commands for downloading data exfiltration tools. System logs from 'SecureBank' show anomalous process creation events at 14:30 UTC on February 15, 2024, though these were initially dismissed as false positives due to high network traffic during a quarterly audit.\n\n**Persistence:** To maintain access, the actors added a reverse shell command to /etc/profile on Unix-based systems and created a backdoor in KeePass using a malicious config file and in TortoiseSVN using a registry hook, leveraging SILENTTRINITY frameworks observed in previous training scenarios. Additionally, the threat actor deployed a new Azure virtual machine from a custom snapshot to evade detection, as noted in cloud activity logs from 'AzureMonitor' with timestamps around March 1, 2024.\n\n**Defense Evasion:** The actors used raw sockets to transmit data directly at the network layer, implementing port knocking to evade port monitoring while calling 'aws secretsmanager get-secret-value --secret-id encryption-keys' to collect cryptographic material from cloud secrets management stores. Background: 'SecureBank' had recently migrated to hybrid cloud infrastructure, but misconfigured IAM policies allowed excessive permissions, as highlighted in an internal security review report dated February 10, 2024.\n\n**Exfiltration:** Finally, the threat actor exploited Bluetooth RFCOMM channels to transfer stolen financial records, exfiltrating data over Bluetooth from compromised endpoints during off-hours. Network logs from 'SecureBank' show unusual Bluetooth pairing attempts on March 5, 2024, though these were not correlated with other alerts due to segmentation issues in the SIEM.\n\n### Recommendations for Blue Teams\n- Enhance email filtering for password-protected attachments and monitor software supply chains for integrity violations.\n- Implement strict access controls and audit cloud snapshot usage and secrets management APIs.\n- Deploy network monitoring for raw socket traffic and Bluetooth anomalies, and conduct regular reviews of authentication processes and shell configurations.",
    "tagged_text": "### Attack Narrative and Kill-Chain Analysis\n\n**Initial Access:** The campaign began with targeted phishing emails [T1566] sent to employees at a fictional financial firm, 'SecureBank Inc.', which included password-protected ZIP files containing trojanized executables designed to mimic legitimate software updates. Concurrently, the actors compromised a third-party software repository used by 'SecureBank' for internal tools, substituting the authentic release package with a maliciously modified executable [T1195.002] that was distributed via automated update mechanisms.\n\n**Execution:** Upon execution, the malware dropped a malicious CHM file named 'help.chm' into the temp directory [T1218.001] and employed Windows Command Shell [T1059.003] to execute cmd.exe, providing a reverse shell to adversaries while simultaneously modifying the malicious.lnk file to include obfuscated commands for downloading data exfiltration tools [T1027.012]. System logs from 'SecureBank' show anomalous process creation events at 14:30 UTC on February 15, 2024, though these were initially dismissed as false positives due to high network traffic during a quarterly audit.\n\n**Persistence:** To maintain access, the actors added a reverse shell command to /etc/profile on Unix-based systems [T1546.004] and created a backdoor in KeePass using a malicious config file and in TortoiseSVN using a registry hook [T1556], leveraging SILENTTRINITY frameworks observed in previous training scenarios. Additionally, the threat actor deployed a new Azure virtual machine from a custom snapshot to evade detection [T1578.001], as noted in cloud activity logs from 'AzureMonitor' with timestamps around March 1, 2024.\n\n**Defense Evasion:** The actors used raw sockets to transmit data directly at the network layer, implementing port knocking [T1205.001] to evade port monitoring while calling 'aws secretsmanager get-secret-value --secret-id encryption-keys' to collect cryptographic material from cloud secrets management stores [T1555.006]. Background: 'SecureBank' had recently migrated to hybrid cloud infrastructure, but misconfigured IAM policies allowed excessive permissions, as highlighted in an internal security review report dated February 10, 2024.\n\n**Exfiltration:** Finally, the threat actor exploited Bluetooth RFCOMM channels to transfer stolen financial records [T1011.001], exfiltrating data over Bluetooth from compromised endpoints during off-hours. Network logs from 'SecureBank' show unusual Bluetooth pairing attempts on March 5, 2024, though these were not correlated with other alerts due to segmentation issues in the SIEM.\n\n### Recommendations for Blue Teams\n- Enhance email filtering for password-protected attachments and monitor software supply chains for integrity violations.\n- Implement strict access controls and audit cloud snapshot usage and secrets management APIs.\n- Deploy network monitoring for raw socket traffic and Bluetooth anomalies, and conduct regular reviews of authentication processes and shell configurations.",
    "sentence_annotations": [
        {
            "sentence": "### Attack Narrative and Kill-Chain Analysis\n\n**Initial Access:** The campaign began with targeted phishing emails sent to employees at a fictional financial firm, 'SecureBank Inc.",
            "technique_id": "T1566",
            "technique_name": "Phishing"
        },
        {
            "sentence": "004] and created a backdoor in KeePass using a malicious config file and in TortoiseSVN using a registry hook, leveraging SILENTTRINITY frameworks observed in previous training scenarios.",
            "technique_id": "T1556",
            "technique_name": "Modify Authentication Process"
        }
    ],
    "llm_raw_response": {
        "title": "Joint Cybersecurity Advisory: Fictional APT Campaign 'ShadowHarbor' Targeting Financial and Cloud Infrastructure",
        "summary": "This advisory details a simulated campaign by the fictional threat actor group 'ShadowHarbor', which targeted financial institutions and cloud environments using sophisticated techniques to bypass detection, establish persistence, and exfiltrate sensitive data. The campaign involved phishing, supply chain compromise, and multi-layered evasion tactics, as observed in training exercises between January and March 2024. Blue teams are advised to review logs and implement defensive measures.",
        "full_report_text": "### Attack Narrative and Kill-Chain Analysis\n\n**Initial Access:** The campaign began with targeted phishing emails [T1566] sent to employees at a fictional financial firm, 'SecureBank Inc.', which included password-protected ZIP files containing trojanized executables designed to mimic legitimate software updates. Concurrently, the actors compromised a third-party software repository used by 'SecureBank' for internal tools, substituting the authentic release package with a maliciously modified executable [T1195.002] that was distributed via automated update mechanisms.\n\n**Execution:** Upon execution, the malware dropped a malicious CHM file named 'help.chm' into the temp directory [T1218.001] and employed Windows Command Shell [T1059.003] to execute cmd.exe, providing a reverse shell to adversaries while simultaneously modifying the malicious.lnk file to include obfuscated commands for downloading data exfiltration tools [T1027.012]. System logs from 'SecureBank' show anomalous process creation events at 14:30 UTC on February 15, 2024, though these were initially dismissed as false positives due to high network traffic during a quarterly audit.\n\n**Persistence:** To maintain access, the actors added a reverse shell command to /etc/profile on Unix-based systems [T1546.004] and created a backdoor in KeePass using a malicious config file and in TortoiseSVN using a registry hook [T1556], leveraging SILENTTRINITY frameworks observed in previous training scenarios. Additionally, the threat actor deployed a new Azure virtual machine from a custom snapshot to evade detection [T1578.001], as noted in cloud activity logs from 'AzureMonitor' with timestamps around March 1, 2024.\n\n**Defense Evasion:** The actors used raw sockets to transmit data directly at the network layer, implementing port knocking [T1205.001] to evade port monitoring while calling 'aws secretsmanager get-secret-value --secret-id encryption-keys' to collect cryptographic material from cloud secrets management stores [T1555.006]. Background: 'SecureBank' had recently migrated to hybrid cloud infrastructure, but misconfigured IAM policies allowed excessive permissions, as highlighted in an internal security review report dated February 10, 2024.\n\n**Exfiltration:** Finally, the threat actor exploited Bluetooth RFCOMM channels to transfer stolen financial records [T1011.001], exfiltrating data over Bluetooth from compromised endpoints during off-hours. Network logs from 'SecureBank' show unusual Bluetooth pairing attempts on March 5, 2024, though these were not correlated with other alerts due to segmentation issues in the SIEM.\n\n### Recommendations for Blue Teams\n- Enhance email filtering for password-protected attachments and monitor software supply chains for integrity violations.\n- Implement strict access controls and audit cloud snapshot usage and secrets management APIs.\n- Deploy network monitoring for raw socket traffic and Bluetooth anomalies, and conduct regular reviews of authentication processes and shell configurations.",
        "techniques_used": [
            "T1566",
            "T1195.002",
            "T1059.003",
            "T1546.004",
            "T1578.001",
            "T1218.001",
            "T1027.012",
            "T1555.006",
            "T1556",
            "T1205.001",
            "T1011.001"
        ]
    }
}