{
    "report_id": "report_574",
    "generated_at": "20251222_164701",
    "scenario_target_ids": [
        "T1566.003",
        "T1059.006",
        "T1098.002",
        "T1211",
        "T1564.014",
        "T1518",
        "T1021.004",
        "T1090.003",
        "T1001",
        "T1537"
    ],
    "scenario_flow": [
        "initial-access",
        "execution",
        "persistence",
        "defense-evasion",
        "defense-evasion",
        "discovery",
        "lateral-movement",
        "command-and-control",
        "command-and-control",
        "exfiltration"
    ],
    "llm_declared_ids": [
        "T1566.003",
        "T1059.006",
        "T1098.002",
        "T1211",
        "T1564.014",
        "T1518",
        "T1021.004",
        "T1090.003",
        "T1001",
        "T1537"
    ],
    "actual_found_ids": [
        "T1566.003",
        "T1059.006"
    ],
    "clean_text": "On 2024-08-15, a fictional multinational corporation, 'TechGlobal Inc.', reported suspicious activity in its network. TechGlobal Inc., headquartered in New York with operations in software development and cloud services, experienced initial access via a spearphishing campaign where adversaries impersonated recruiters on LinkedIn to send malicious job advertisements to HR personnel. System logs from the email server show unusual login attempts from IP 192.168.1.100, but these were unrelated. Upon execution, the malware, a Python-based backdoor compiled with PyInstaller, was deployed to establish persistence and conduct initial reconnaissance. The actors then leveraged PowerShell scripts to grant themselves full access permissions to executive email accounts while simultaneously exploiting anti-exploitation mechanisms to evade defenses [T1098.002, T1211]. Network traffic analysis revealed encrypted packets from internal subnet 10.0.0.0/24, though this was benign. For defense evasion, the implant used extended attributes to hide execution traces and employed data obfuscation by encoding command-and-control traffic with base64 to avoid network detection [T1564.014, T1001]. During lateral movement, the malware performed software discovery to identify installed tools like .NET and PowerShell, and utilized SSH to pivot to other systems within the network [T1518, T1021.004]. Exfiltration was achieved by establishing multi-hop proxy connections through Tor exit nodes to obfuscate communications, and the threat actor transferred sensitive data to a malicious Azure subscription using native backup functionality [T1090.003, T1537]. Incident responders noted anomalous log entries in the SIEM, but these were later attributed to a misconfigured firewall rule.",
    "tagged_text": "On 2024-08-15, a fictional multinational corporation, 'TechGlobal Inc.', reported suspicious activity in its network. TechGlobal Inc., headquartered in New York with operations in software development and cloud services, experienced initial access via a spearphishing campaign where adversaries impersonated recruiters on LinkedIn to send malicious job advertisements to HR personnel [T1566.003]. System logs from the email server show unusual login attempts from IP 192.168.1.100, but these were unrelated. Upon execution, the malware, a Python-based backdoor compiled with PyInstaller, was deployed to establish persistence and conduct initial reconnaissance [T1059.006]. The actors then leveraged PowerShell scripts to grant themselves full access permissions to executive email accounts while simultaneously exploiting anti-exploitation mechanisms to evade defenses [T1098.002, T1211]. Network traffic analysis revealed encrypted packets from internal subnet 10.0.0.0/24, though this was benign. For defense evasion, the implant used extended attributes to hide execution traces and employed data obfuscation by encoding command-and-control traffic with base64 to avoid network detection [T1564.014, T1001]. During lateral movement, the malware performed software discovery to identify installed tools like .NET and PowerShell, and utilized SSH to pivot to other systems within the network [T1518, T1021.004]. Exfiltration was achieved by establishing multi-hop proxy connections through Tor exit nodes to obfuscate communications, and the threat actor transferred sensitive data to a malicious Azure subscription using native backup functionality [T1090.003, T1537]. Incident responders noted anomalous log entries in the SIEM, but these were later attributed to a misconfigured firewall rule.",
    "sentence_annotations": [],
    "llm_raw_response": {
        "title": "Joint Cybersecurity Advisory: Fictional APT Campaign 'ShadowLink' Targeting Corporate Networks",
        "summary": "This advisory details a simulated campaign by a fictional APT group, 'ShadowLink', targeting corporate networks through spearphishing, Python-based malware, and cloud data exfiltration. Based on intelligence from CISA, FBI, and NSA, this report is for blue team training to enhance detection and response capabilities.",
        "full_report_text": "On 2024-08-15, a fictional multinational corporation, 'TechGlobal Inc.', reported suspicious activity in its network. TechGlobal Inc., headquartered in New York with operations in software development and cloud services, experienced initial access via a spearphishing campaign where adversaries impersonated recruiters on LinkedIn to send malicious job advertisements to HR personnel [T1566.003]. System logs from the email server show unusual login attempts from IP 192.168.1.100, but these were unrelated. Upon execution, the malware, a Python-based backdoor compiled with PyInstaller, was deployed to establish persistence and conduct initial reconnaissance [T1059.006]. The actors then leveraged PowerShell scripts to grant themselves full access permissions to executive email accounts while simultaneously exploiting anti-exploitation mechanisms to evade defenses [T1098.002, T1211]. Network traffic analysis revealed encrypted packets from internal subnet 10.0.0.0/24, though this was benign. For defense evasion, the implant used extended attributes to hide execution traces and employed data obfuscation by encoding command-and-control traffic with base64 to avoid network detection [T1564.014, T1001]. During lateral movement, the malware performed software discovery to identify installed tools like .NET and PowerShell, and utilized SSH to pivot to other systems within the network [T1518, T1021.004]. Exfiltration was achieved by establishing multi-hop proxy connections through Tor exit nodes to obfuscate communications, and the threat actor transferred sensitive data to a malicious Azure subscription using native backup functionality [T1090.003, T1537]. Incident responders noted anomalous log entries in the SIEM, but these were later attributed to a misconfigured firewall rule.",
        "techniques_used": [
            "T1566.003",
            "T1059.006",
            "T1098.002",
            "T1211",
            "T1564.014",
            "T1518",
            "T1021.004",
            "T1090.003",
            "T1001",
            "T1537"
        ]
    }
}