{
    "report_id": "report_334",
    "generated_at": "20251222_150257",
    "scenario_target_ids": [
        "T1584.002",
        "T1195.002",
        "T1059",
        "T1547.012",
        "T1055.014",
        "T1072",
        "T1095",
        "T1495"
    ],
    "scenario_flow": [
        "resource-development",
        "initial-access",
        "execution",
        "persistence",
        "defense-evasion",
        "lateral-movement",
        "command-and-control",
        "impact"
    ],
    "llm_declared_ids": [
        "T1195.002",
        "T1584.002",
        "T1059",
        "T1072",
        "T1547.012",
        "T1055.014",
        "T1095",
        "T1495"
    ],
    "actual_found_ids": [
        "T1055.014",
        "T1195.002",
        "T1095",
        "T1495",
        "T1547.012",
        "T1059",
        "T1072",
        "T1584.002"
    ],
    "clean_text": "The Federal Bureau of Investigation (FBI), CISA, and NSA are releasing this joint Cybersecurity Advisory to report on the activities of the fictional advanced persistent threat (APT) group 'ShadowPhantom', which has been observed targeting critical infrastructure sectors, including energy and manufacturing. This campaign demonstrates a sophisticated blend of techniques designed to evade traditional defenses and establish persistent access.\n\nInitial Access: The actors began by compromising the software supply chain, placing trojanized installers for industrial control system (ICS) software on legitimate vendor app stores, which were then downloaded by unsuspecting victims. Concurrently, they manipulated DNS A records for a corporate login portal to redirect users to a phishing server, harvesting credentials to gain initial footholds into targeted networks. For example, on 2023-10-15, logs from 'IndustrialCorp' showed anomalous DNS queries resolving to IP 192.168.1.100, which was later identified as a malicious server.\n\nExecution: Upon execution of the trojanized installer, the malware employed a command and scripting interpreter, using SQL scripts to perform tasks on victim machines, such as querying database configurations and exfiltrating sensitive data. The actors also leveraged software deployment tools, utilizing RAdmin to remotely control workstations and manipulate system settings across the network.\n\nPersistence: To maintain access, ShadowPhantom installed a malicious DLL in the print processors directory, specifically dropping 'winprint.dll' into C:\\Windows\\System32\\spool\\prtprocs\\x64\\ to be loaded automatically by the spoolsv service, ensuring the malware persisted through reboots. Additionally, they used VDSO hijacking, attaching to legitimate browser processes via ptrace to execute injected code and evade detection by security software.\n\nCommand and Control (C2): The group established C2 channels using non-application layer protocols, such as SSH, to provide backdoor access that leveraged PAM for authentication, allowing stealthy communication over standard network ports. Network traffic analysis revealed encrypted SSH sessions originating from internal IPs to external servers in suspicious regions.\n\nImpact: In the final stage, ShadowPhantom executed firmware corruption, injecting malicious code into the UEFI firmware flash utility to prevent legitimate updates and cause boot failures, rendering affected systems inoperable and complicating recovery efforts. This was observed in multiple incidents where systems failed to boot after scheduled maintenance, with error logs indicating firmware integrity violations.\n\nMitigation recommendations include monitoring for unusual DNS changes, verifying software integrity from trusted sources, and implementing firmware security measures. This report is based on fictional data for educational purposes only.",
    "tagged_text": "The Federal Bureau of Investigation (FBI), CISA, and NSA are releasing this joint Cybersecurity Advisory to report on the activities of the fictional advanced persistent threat (APT) group 'ShadowPhantom', which has been observed targeting critical infrastructure sectors, including energy and manufacturing. This campaign demonstrates a sophisticated blend of techniques designed to evade traditional defenses and establish persistent access.\n\nInitial Access: The actors began by compromising the software supply chain [T1195.002], placing trojanized installers for industrial control system (ICS) software on legitimate vendor app stores, which were then downloaded by unsuspecting victims. Concurrently, they manipulated DNS A records for a corporate login portal to redirect users to a phishing server [T1584.002], harvesting credentials to gain initial footholds into targeted networks. For example, on 2023-10-15, logs from 'IndustrialCorp' showed anomalous DNS queries resolving to IP 192.168.1.100, which was later identified as a malicious server.\n\nExecution: Upon execution of the trojanized installer, the malware employed a command and scripting interpreter [T1059], using SQL scripts to perform tasks on victim machines, such as querying database configurations and exfiltrating sensitive data. The actors also leveraged software deployment tools [T1072], utilizing RAdmin to remotely control workstations and manipulate system settings across the network.\n\nPersistence: To maintain access, ShadowPhantom installed a malicious DLL in the print processors directory [T1547.012], specifically dropping 'winprint.dll' into C:\\Windows\\System32\\spool\\prtprocs\\x64\\ to be loaded automatically by the spoolsv service, ensuring the malware persisted through reboots. Additionally, they used VDSO hijacking [T1055.014], attaching to legitimate browser processes via ptrace to execute injected code and evade detection by security software.\n\nCommand and Control (C2): The group established C2 channels using non-application layer protocols [T1095], such as SSH, to provide backdoor access that leveraged PAM for authentication, allowing stealthy communication over standard network ports. Network traffic analysis revealed encrypted SSH sessions originating from internal IPs to external servers in suspicious regions.\n\nImpact: In the final stage, ShadowPhantom executed firmware corruption [T1495], injecting malicious code into the UEFI firmware flash utility to prevent legitimate updates and cause boot failures, rendering affected systems inoperable and complicating recovery efforts. This was observed in multiple incidents where systems failed to boot after scheduled maintenance, with error logs indicating firmware integrity violations.\n\nMitigation recommendations include monitoring for unusual DNS changes, verifying software integrity from trusted sources, and implementing firmware security measures. This report is based on fictional data for educational purposes only.",
    "sentence_annotations": [
        {
            "sentence": "Execution: Upon execution of the trojanized installer, the malware employed a command and scripting interpreter, using SQL scripts to perform tasks on victim machines, such as querying database configurations and exfiltrating sensitive data.",
            "technique_id": "T1059",
            "technique_name": "Command and Scripting Interpreter"
        },
        {
            "sentence": "The actors also leveraged software deployment tools, utilizing RAdmin to remotely control workstations and manipulate system settings across the network.",
            "technique_id": "T1072",
            "technique_name": "Software Deployment Tools"
        },
        {
            "sentence": "Command and Control (C2): The group established C2 channels using non-application layer protocols, such as SSH, to provide backdoor access that leveraged PAM for authentication, allowing stealthy communication over standard network ports.",
            "technique_id": "T1095",
            "technique_name": "Non-Application Layer Protocol"
        },
        {
            "sentence": "Impact: In the final stage, ShadowPhantom executed firmware corruption, injecting malicious code into the UEFI firmware flash utility to prevent legitimate updates and cause boot failures, rendering affected systems inoperable and complicating recovery efforts.",
            "technique_id": "T1495",
            "technique_name": "Firmware Corruption"
        }
    ],
    "llm_raw_response": {
        "title": "Joint Cybersecurity Advisory: Fictional APT Campaign 'ShadowPhantom' Targeting Critical Infrastructure",
        "summary": "This advisory details a simulated campaign by the fictional threat actor 'ShadowPhantom', which combines supply chain compromise, DNS manipulation, and firmware corruption to infiltrate industrial control systems. Blue teams should use this report for training to identify and mitigate multi-stage attacks leveraging legitimate tools and protocols.",
        "full_report_text": "The Federal Bureau of Investigation (FBI), CISA, and NSA are releasing this joint Cybersecurity Advisory to report on the activities of the fictional advanced persistent threat (APT) group 'ShadowPhantom', which has been observed targeting critical infrastructure sectors, including energy and manufacturing. This campaign demonstrates a sophisticated blend of techniques designed to evade traditional defenses and establish persistent access.\n\nInitial Access: The actors began by compromising the software supply chain [T1195.002], placing trojanized installers for industrial control system (ICS) software on legitimate vendor app stores, which were then downloaded by unsuspecting victims. Concurrently, they manipulated DNS A records for a corporate login portal to redirect users to a phishing server [T1584.002], harvesting credentials to gain initial footholds into targeted networks. For example, on 2023-10-15, logs from 'IndustrialCorp' showed anomalous DNS queries resolving to IP 192.168.1.100, which was later identified as a malicious server.\n\nExecution: Upon execution of the trojanized installer, the malware employed a command and scripting interpreter [T1059], using SQL scripts to perform tasks on victim machines, such as querying database configurations and exfiltrating sensitive data. The actors also leveraged software deployment tools [T1072], utilizing RAdmin to remotely control workstations and manipulate system settings across the network.\n\nPersistence: To maintain access, ShadowPhantom installed a malicious DLL in the print processors directory [T1547.012], specifically dropping 'winprint.dll' into C:\\Windows\\System32\\spool\\prtprocs\\x64\\ to be loaded automatically by the spoolsv service, ensuring the malware persisted through reboots. Additionally, they used VDSO hijacking [T1055.014], attaching to legitimate browser processes via ptrace to execute injected code and evade detection by security software.\n\nCommand and Control (C2): The group established C2 channels using non-application layer protocols [T1095], such as SSH, to provide backdoor access that leveraged PAM for authentication, allowing stealthy communication over standard network ports. Network traffic analysis revealed encrypted SSH sessions originating from internal IPs to external servers in suspicious regions.\n\nImpact: In the final stage, ShadowPhantom executed firmware corruption [T1495], injecting malicious code into the UEFI firmware flash utility to prevent legitimate updates and cause boot failures, rendering affected systems inoperable and complicating recovery efforts. This was observed in multiple incidents where systems failed to boot after scheduled maintenance, with error logs indicating firmware integrity violations.\n\nMitigation recommendations include monitoring for unusual DNS changes, verifying software integrity from trusted sources, and implementing firmware security measures. This report is based on fictional data for educational purposes only.",
        "techniques_used": [
            "T1195.002",
            "T1584.002",
            "T1059",
            "T1072",
            "T1547.012",
            "T1055.014",
            "T1095",
            "T1495"
        ]
    }
}