{
    "report_id": "report_337",
    "generated_at": "20251222_150402",
    "scenario_target_ids": [
        "T1592",
        "T1593.001",
        "T1659",
        "T1190",
        "T1675",
        "T1569.003",
        "T1069",
        "T1132",
        "T1567.004"
    ],
    "scenario_flow": [
        "reconnaissance",
        "reconnaissance",
        "initial-access",
        "initial-access",
        "execution",
        "execution",
        "discovery",
        "command-and-control",
        "exfiltration"
    ],
    "llm_declared_ids": [
        "T1592",
        "T1593.001",
        "T1659",
        "T1190",
        "T1675",
        "T1569.003",
        "T1069",
        "T1132",
        "T1567.004"
    ],
    "actual_found_ids": [
        "T1567.004",
        "T1592",
        "T1593.001",
        "T1069",
        "T1132",
        "T1659",
        "T1190",
        "T1675",
        "T1569.003"
    ],
    "clean_text": "APT-FICT, a fictional threat actor assessed to operate with moderate sophistication, initiated a campaign against a U.S.-based energy company, 'PowerGrid Inc.', in early 2024. The company, which manages regional electrical grids, reported anomalous network traffic and unauthorized access to administrative systems. Initial analysis suggests the actors conducted reconnaissance by gathering victim host information through deployed exploit code that collected browser and system details, while simultaneously monitoring social media platforms like Reddit to identify employee grievances and potential insider threats. Following this, the actors exploited a vulnerable FortiGate device to install COATHANGER malware, which then performed content injection by redirecting user traffic through a malicious proxy via a compromised ISP channel. Once inside the network, the malware leveraged the vSphere Web Services SDK to remotely execute malicious commands on ESXi guest systems and used systemctl to start a custom service for persistence. The actors conducted permission groups discovery by running commands like 'net group \"Domain Admins\" /domain' to identify privileged accounts, and they encoded network traffic with gzip to obfuscate command-and-control communications. Finally, exfiltration was achieved over webhooks by posting stolen credentials to a malicious endpoint using HTTP POST requests. Logs from PowerGrid Inc. show increased CPU usage on affected servers, but no financial data was accessed during this incident. The company's background includes operations across three states, with a recent software update applied two weeks prior to the attack.",
    "tagged_text": "APT-FICT, a fictional threat actor assessed to operate with moderate sophistication, initiated a campaign against a U.S.-based energy company, 'PowerGrid Inc.', in early 2024. The company, which manages regional electrical grids, reported anomalous network traffic and unauthorized access to administrative systems. Initial analysis suggests the actors conducted reconnaissance by gathering victim host information [T1592] through deployed exploit code that collected browser and system details, while simultaneously monitoring social media platforms like Reddit [T1593.001] to identify employee grievances and potential insider threats. Following this, the actors exploited a vulnerable FortiGate device [T1190] to install COATHANGER malware, which then performed content injection [T1659] by redirecting user traffic through a malicious proxy via a compromised ISP channel. Once inside the network, the malware leveraged the vSphere Web Services SDK [T1675] to remotely execute malicious commands on ESXi guest systems and used systemctl [T1569.003] to start a custom service for persistence. The actors conducted permission groups discovery [T1069] by running commands like 'net group \"Domain Admins\" /domain' to identify privileged accounts, and they encoded network traffic with gzip [T1132] to obfuscate command-and-control communications. Finally, exfiltration was achieved over webhooks [T1567.004] by posting stolen credentials to a malicious endpoint using HTTP POST requests. Logs from PowerGrid Inc. show increased CPU usage on affected servers, but no financial data was accessed during this incident. The company's background includes operations across three states, with a recent software update applied two weeks prior to the attack.",
    "sentence_annotations": [
        {
            "sentence": "Initial analysis suggests the actors conducted reconnaissance by gathering victim host information through deployed exploit code that collected browser and system details, while simultaneously monitoring social media platforms like Reddit [T1593.",
            "technique_id": "T1592",
            "technique_name": "Gather Victim Host Information"
        },
        {
            "sentence": "Following this, the actors exploited a vulnerable FortiGate device to install COATHANGER malware, which then performed content injection by redirecting user traffic through a malicious proxy via a compromised ISP channel.",
            "technique_id": "T1190",
            "technique_name": "Exploit Public-Facing Application"
        },
        {
            "sentence": "Following this, the actors exploited a vulnerable FortiGate device to install COATHANGER malware, which then performed content injection by redirecting user traffic through a malicious proxy via a compromised ISP channel.",
            "technique_id": "T1659",
            "technique_name": "Content Injection"
        },
        {
            "sentence": "Once inside the network, the malware leveraged the vSphere Web Services SDK to remotely execute malicious commands on ESXi guest systems and used systemctl [T1569.",
            "technique_id": "T1675",
            "technique_name": "ESXi Administration Command"
        },
        {
            "sentence": "The actors conducted permission groups discovery by running commands like 'net group \"Domain Admins\" /domain' to identify privileged accounts, and they encoded network traffic with gzip to obfuscate command-and-control communications.",
            "technique_id": "T1069",
            "technique_name": "Permission Groups Discovery"
        },
        {
            "sentence": "The actors conducted permission groups discovery by running commands like 'net group \"Domain Admins\" /domain' to identify privileged accounts, and they encoded network traffic with gzip to obfuscate command-and-control communications.",
            "technique_id": "T1132",
            "technique_name": "Data Encoding"
        }
    ],
    "llm_raw_response": {
        "title": "Joint Cybersecurity Advisory: Fictional APT Campaign Targeting Critical Infrastructure",
        "summary": "This advisory details a simulated campaign by a fictional advanced persistent threat (APT) group, designated as APT-FICT, targeting critical infrastructure sectors. The campaign leverages social engineering, exploitation of public-facing applications, and sophisticated post-exploitation techniques to compromise networks, exfiltrate data, and maintain persistence. Blue teams are advised to review logs, implement mitigations, and enhance monitoring for similar indicators of compromise (IoCs).",
        "full_report_text": "APT-FICT, a fictional threat actor assessed to operate with moderate sophistication, initiated a campaign against a U.S.-based energy company, 'PowerGrid Inc.', in early 2024. The company, which manages regional electrical grids, reported anomalous network traffic and unauthorized access to administrative systems. Initial analysis suggests the actors conducted reconnaissance by gathering victim host information [T1592] through deployed exploit code that collected browser and system details, while simultaneously monitoring social media platforms like Reddit [T1593.001] to identify employee grievances and potential insider threats. Following this, the actors exploited a vulnerable FortiGate device [T1190] to install COATHANGER malware, which then performed content injection [T1659] by redirecting user traffic through a malicious proxy via a compromised ISP channel. Once inside the network, the malware leveraged the vSphere Web Services SDK [T1675] to remotely execute malicious commands on ESXi guest systems and used systemctl [T1569.003] to start a custom service for persistence. The actors conducted permission groups discovery [T1069] by running commands like 'net group \"Domain Admins\" /domain' to identify privileged accounts, and they encoded network traffic with gzip [T1132] to obfuscate command-and-control communications. Finally, exfiltration was achieved over webhooks [T1567.004] by posting stolen credentials to a malicious endpoint using HTTP POST requests. Logs from PowerGrid Inc. show increased CPU usage on affected servers, but no financial data was accessed during this incident. The company's background includes operations across three states, with a recent software update applied two weeks prior to the attack.",
        "techniques_used": [
            "T1592",
            "T1593.001",
            "T1659",
            "T1190",
            "T1675",
            "T1569.003",
            "T1069",
            "T1132",
            "T1567.004"
        ]
    }
}