{
    "report_id": "report_218",
    "generated_at": "20251222_141452",
    "scenario_target_ids": [
        "T1588.004",
        "T1195.001",
        "T1059.001",
        "T1559.002",
        "T1574.007",
        "T1036.005",
        "T1070",
        "T1016",
        "T1538",
        "T1071.005",
        "T1104",
        "T1052.001"
    ],
    "scenario_flow": [
        "resource-development",
        "initial-access",
        "execution",
        "execution",
        "persistence",
        "defense-evasion",
        "defense-evasion",
        "discovery",
        "discovery",
        "command-and-control",
        "command-and-control",
        "exfiltration"
    ],
    "llm_declared_ids": [
        "T1588.004",
        "T1195.001",
        "T1059.001",
        "T1559.002",
        "T1574.007",
        "T1036.005",
        "T1070",
        "T1016",
        "T1538",
        "T1071.005",
        "T1104",
        "T1052.001"
    ],
    "actual_found_ids": [
        "T1070",
        "T1195.001",
        "T1104",
        "T1589",
        "T1071.005",
        "T1538",
        "T1574.007",
        "T1559.002",
        "T1105",
        "T1016",
        "T1588.004",
        "T1052.001",
        "T1036.005",
        "T1059.001"
    ],
    "clean_text": "Background: ShadowVeil, a fictional advanced persistent threat (APT) group, has been observed targeting financial organizations in North America and Europe since early 2024. Their operations focus on stealing intellectual property and customer data. This report is based on simulated incident response logs from a fictional victim, 'Global Finance Corp', which reported unusual network activity on March 15, 2024. System logs from their Azure environment showed spikes in PowerShell usage, but initial scans flagged no malware.\n\nKill-Chain Analysis:\n- Initial Access: The actors likely conduct reconnaissance to identify weak points, though this is not directly observed in logs. They compromised the software development pipeline at a third-party vendor, injecting a malicious script 'evil.ps1' into build tools to harvest environment variables. This allowed them to steal credentials and gain initial foothold into Global Finance Corp's network.\n- Execution: Upon access, the adversary employed PowerShell to execute commands delivered through Dynamic Data Exchange (DDE) in a weaponized Word document, mimicking APT28 tactics to deploy payloads like 'JHUHUGIT'. They simultaneously downloaded additional tools and modified the PATH environment variable to ensure their malicious version of 'net.exe' would execute instead of the legitimate system one, while masquerading files as legitimate Adobe Content Management System resources to avoid suspicion.\n- Persistence and Defense Evasion: To maintain access, ShadowVeil used stolen SSL certificates for their command and control (C2) domains, obtained through prior campaigns. They deployed 'remote_access_tool.exe' to establish persistent multi-stage C2 channels and employed indicator removal techniques by deleting created WMI objects to evade detections. Network logs show anomalous XMPP traffic, where compromised credentials were transmitted through private messages disguised as legitimate chat traffic using publish/subscribe protocols.\n- Discovery and Exfiltration: The actors conducted system network configuration discovery to retrieve internal IP addresses of compromised hosts and leveraged cloud service dashboards, such as GCP Command Center, to discover storage buckets with weak access controls. Finally, they used USB devices to exfiltrate collected system information and network configurations from the compromised machine, completing the data theft phase.\n\nRecommendations: Blue teams should monitor for unusual PowerShell activity, review software dependencies, and enforce strict access controls on cloud resources. This fictional scenario underscores the importance of layered defense strategies.",
    "tagged_text": "Background: ShadowVeil, a fictional advanced persistent threat (APT) group, has been observed targeting financial organizations in North America and Europe since early 2024. Their operations focus on stealing intellectual property and customer data. This report is based on simulated incident response logs from a fictional victim, 'Global Finance Corp', which reported unusual network activity on March 15, 2024. System logs from their Azure environment showed spikes in PowerShell usage, but initial scans flagged no malware.\n\nKill-Chain Analysis:\n- Initial Access: The actors likely conduct reconnaissance [T1589] to identify weak points, though this is not directly observed in logs. They compromised the software development pipeline at a third-party vendor, injecting a malicious script 'evil.ps1' into build tools to harvest environment variables [T1195.001]. This allowed them to steal credentials and gain initial foothold into Global Finance Corp's network.\n- Execution: Upon access, the adversary employed PowerShell [T1059.001] to execute commands delivered through Dynamic Data Exchange (DDE) in a weaponized Word document, mimicking APT28 tactics to deploy payloads like 'JHUHUGIT' [T1559.002]. They simultaneously downloaded additional tools [T1105] and modified the PATH environment variable to ensure their malicious version of 'net.exe' would execute instead of the legitimate system one [T1574.007], while masquerading files as legitimate Adobe Content Management System resources to avoid suspicion [T1036.005].\n- Persistence and Defense Evasion: To maintain access, ShadowVeil used stolen SSL certificates for their command and control (C2) domains, obtained through prior campaigns [T1588.004]. They deployed 'remote_access_tool.exe' to establish persistent multi-stage C2 channels [T1104] and employed indicator removal techniques by deleting created WMI objects to evade detections [T1070]. Network logs show anomalous XMPP traffic, where compromised credentials were transmitted through private messages disguised as legitimate chat traffic using publish/subscribe protocols [T1071.005].\n- Discovery and Exfiltration: The actors conducted system network configuration discovery to retrieve internal IP addresses of compromised hosts [T1016] and leveraged cloud service dashboards, such as GCP Command Center, to discover storage buckets with weak access controls [T1538]. Finally, they used USB devices to exfiltrate collected system information and network configurations from the compromised machine [T1052.001], completing the data theft phase.\n\nRecommendations: Blue teams should monitor for unusual PowerShell activity, review software dependencies, and enforce strict access controls on cloud resources. This fictional scenario underscores the importance of layered defense strategies.",
    "sentence_annotations": [
        {
            "sentence": "Kill-Chain Analysis:\n- Initial Access: The actors likely conduct reconnaissance to identify weak points, though this is not directly observed in logs.",
            "technique_id": "T1589",
            "technique_name": "Gather Victim Identity Information"
        },
        {
            "sentence": "They simultaneously downloaded additional tools and modified the PATH environment variable to ensure their malicious version of 'net.",
            "technique_id": "T1105",
            "technique_name": "Ingress Tool Transfer"
        },
        {
            "sentence": "exe' to establish persistent multi-stage C2 channels and employed indicator removal techniques by deleting created WMI objects to evade detections.",
            "technique_id": "T1104",
            "technique_name": "Multi-Stage Channels"
        },
        {
            "sentence": "exe' to establish persistent multi-stage C2 channels and employed indicator removal techniques by deleting created WMI objects to evade detections.",
            "technique_id": "T1070",
            "technique_name": "Indicator Removal"
        },
        {
            "sentence": "- Discovery and Exfiltration: The actors conducted system network configuration discovery to retrieve internal IP addresses of compromised hosts and leveraged cloud service dashboards, such as GCP Command Center, to discover storage buckets with weak access controls.",
            "technique_id": "T1016",
            "technique_name": "System Network Configuration Discovery"
        },
        {
            "sentence": "- Discovery and Exfiltration: The actors conducted system network configuration discovery to retrieve internal IP addresses of compromised hosts and leveraged cloud service dashboards, such as GCP Command Center, to discover storage buckets with weak access controls.",
            "technique_id": "T1538",
            "technique_name": "Cloud Service Dashboard"
        }
    ],
    "llm_raw_response": {
        "title": "Joint Cybersecurity Advisory: Fictional APT Campaign 'ShadowVeil' Targeting Financial Sector",
        "summary": "This advisory details a simulated campaign by the fictional threat actor 'ShadowVeil', which targets financial institutions through supply chain compromise and sophisticated evasion techniques. The campaign leverages stolen digital certificates, malicious PowerShell scripts, and cloud reconnaissance to exfiltrate sensitive data, providing training for blue teams on multi-stage attack detection and response.",
        "full_report_text": "Background: ShadowVeil, a fictional advanced persistent threat (APT) group, has been observed targeting financial organizations in North America and Europe since early 2024. Their operations focus on stealing intellectual property and customer data. This report is based on simulated incident response logs from a fictional victim, 'Global Finance Corp', which reported unusual network activity on March 15, 2024. System logs from their Azure environment showed spikes in PowerShell usage, but initial scans flagged no malware.\n\nKill-Chain Analysis:\n- Initial Access: The actors likely conduct reconnaissance [T1589] to identify weak points, though this is not directly observed in logs. They compromised the software development pipeline at a third-party vendor, injecting a malicious script 'evil.ps1' into build tools to harvest environment variables [T1195.001]. This allowed them to steal credentials and gain initial foothold into Global Finance Corp's network.\n- Execution: Upon access, the adversary employed PowerShell [T1059.001] to execute commands delivered through Dynamic Data Exchange (DDE) in a weaponized Word document, mimicking APT28 tactics to deploy payloads like 'JHUHUGIT' [T1559.002]. They simultaneously downloaded additional tools [T1105] and modified the PATH environment variable to ensure their malicious version of 'net.exe' would execute instead of the legitimate system one [T1574.007], while masquerading files as legitimate Adobe Content Management System resources to avoid suspicion [T1036.005].\n- Persistence and Defense Evasion: To maintain access, ShadowVeil used stolen SSL certificates for their command and control (C2) domains, obtained through prior campaigns [T1588.004]. They deployed 'remote_access_tool.exe' to establish persistent multi-stage C2 channels [T1104] and employed indicator removal techniques by deleting created WMI objects to evade detections [T1070]. Network logs show anomalous XMPP traffic, where compromised credentials were transmitted through private messages disguised as legitimate chat traffic using publish/subscribe protocols [T1071.005].\n- Discovery and Exfiltration: The actors conducted system network configuration discovery to retrieve internal IP addresses of compromised hosts [T1016] and leveraged cloud service dashboards, such as GCP Command Center, to discover storage buckets with weak access controls [T1538]. Finally, they used USB devices to exfiltrate collected system information and network configurations from the compromised machine [T1052.001], completing the data theft phase.\n\nRecommendations: Blue teams should monitor for unusual PowerShell activity, review software dependencies, and enforce strict access controls on cloud resources. This fictional scenario underscores the importance of layered defense strategies.",
        "techniques_used": [
            "T1588.004",
            "T1195.001",
            "T1059.001",
            "T1559.002",
            "T1574.007",
            "T1036.005",
            "T1070",
            "T1016",
            "T1538",
            "T1071.005",
            "T1104",
            "T1052.001"
        ]
    }
}