{
    "report_id": "report_737",
    "generated_at": "20251223_105412",
    "scenario_target_ids": [
        "T1598.003",
        "T1594",
        "T1583.002",
        "T1078.003",
        "T1566.003",
        "T1129",
        "T1059.002",
        "T1542.002",
        "T1564.003",
        "T1201",
        "T1114",
        "T1025",
        "T1557.003",
        "T1568.001",
        "T1567.004",
        "T1496.002",
        "T1499.001"
    ],
    "scenario_flow": [
        "reconnaissance",
        "reconnaissance",
        "resource-development",
        "initial-access",
        "initial-access",
        "execution",
        "execution",
        "defense-evasion",
        "defense-evasion",
        "discovery",
        "collection",
        "collection",
        "collection",
        "command-and-control",
        "exfiltration",
        "impact",
        "impact"
    ],
    "llm_declared_ids": [
        "T1594",
        "T1598.003",
        "T1566.003",
        "T1059.002",
        "T1564.003",
        "T1583.002",
        "T1542.002",
        "T1129",
        "T1078.003",
        "T1201",
        "T1114",
        "T1025",
        "T1557.003",
        "T1567.004",
        "T1496.002",
        "T1568.001",
        "T1499.001"
    ],
    "actual_found_ids": [
        "T1567.004",
        "T1129",
        "T1564.003",
        "T1114",
        "T1542.002",
        "T1568.001",
        "T1496.002",
        "T1025",
        "T1594",
        "T1583.002",
        "T1557.003",
        "T1566.003",
        "T1201",
        "T1598.003",
        "T1499.001",
        "T1059.002",
        "T1078.003"
    ],
    "clean_text": "Crimson Serpent, a fictional advanced persistent threat (APT) group, has been observed targeting financial organizations in a simulated campaign designed for cybersecurity training. The group operates with a focus on stealth and persistence, leveraging multiple attack vectors to compromise systems and exfiltrate sensitive data.\n\n**Initial Access and Reconnaissance**\nThe campaign begins with actors conducting reconnaissance by enumerating compromised web application resources to identify additional endpoints and resources linked to victim-owned websites. Concurrently, they craft spearphishing emails with hyperlinks designed to trick recipients into revealing account credentials, and use social media channels to spearphish victims via services. Upon successful phishing, the actors gain initial foothold into the network.\n\n**Execution and Persistence**\nOnce inside, the adversary employs AppleScript to inject malicious JavaScript into browsers while executing processes in hidden windows to avoid detection. They install and configure dnsmasq to act as a local DNS server for covert communication and deploy malicious firmware on network interface cards to enable persistent command and control. Additionally, the malware utilizes LoadLibrary to load shared network communication modules for data exfiltration.\n\n**Credential Access and Discovery**\nThe actors collect stored passwords from Windows Credential Manager to access local user accounts and use tools like CrackMapExec to discover password policies applied to target systems. They also execute Outlook.exe to export email messages to local PST files for email collection and run commands like 'forfiles /p D:\\ /s /m *.docx' to find Word documents on external drives for data from removable media.\n\n**Lateral Movement and Exfiltration**\nFor lateral movement, the malware uses DHCP protocol to redirect client traffic through an attacker-controlled proxy via DHCP spoofing. Data exfiltration is achieved by posting stolen credentials to webhook endpoints using HTTP POST requests over exfiltration via webhook, while botnet malware hijacks network resources for large-scale data exfiltration through bandwidth hijacking. To mask traffic, actors register suspicious DNS A records for domains like 'cdn-service.org' using fast flux DNS.\n\n**Impact**\nThe campaign culminates in a denial-of-service attack where scripts execute ACK floods against database servers, consuming processing capacity through OS exhaustion floods. This disrupts operations and highlights the need for robust incident response.\n\n**Mitigation Recommendations**\nBlue teams should implement multi-factor authentication, monitor for unusual DNS and network traffic, and conduct regular security awareness training to counter spearphishing attempts. Logs from this scenario include routine system updates and user login attempts, which are not indicative of malicious activity but should be reviewed for anomalies.",
    "tagged_text": "Crimson Serpent, a fictional advanced persistent threat (APT) group, has been observed targeting financial organizations in a simulated campaign designed for cybersecurity training. The group operates with a focus on stealth and persistence, leveraging multiple attack vectors to compromise systems and exfiltrate sensitive data.\n\n**Initial Access and Reconnaissance**\nThe campaign begins with actors conducting reconnaissance by enumerating compromised web application resources to identify additional endpoints and resources linked to victim-owned websites [T1594]. Concurrently, they craft spearphishing emails with hyperlinks designed to trick recipients into revealing account credentials [T1598.003], and use social media channels to spearphish victims via services [T1566.003]. Upon successful phishing, the actors gain initial foothold into the network.\n\n**Execution and Persistence**\nOnce inside, the adversary employs AppleScript [T1059.002] to inject malicious JavaScript into browsers while executing processes in hidden windows [T1564.003] to avoid detection. They install and configure dnsmasq to act as a local DNS server for covert communication [T1583.002] and deploy malicious firmware on network interface cards to enable persistent command and control [T1542.002]. Additionally, the malware utilizes LoadLibrary to load shared network communication modules for data exfiltration [T1129].\n\n**Credential Access and Discovery**\nThe actors collect stored passwords from Windows Credential Manager to access local user accounts [T1078.003] and use tools like CrackMapExec to discover password policies applied to target systems [T1201]. They also execute Outlook.exe to export email messages to local PST files for email collection [T1114] and run commands like 'forfiles /p D:\\ /s /m *.docx' to find Word documents on external drives for data from removable media [T1025].\n\n**Lateral Movement and Exfiltration**\nFor lateral movement, the malware uses DHCP protocol to redirect client traffic through an attacker-controlled proxy via DHCP spoofing [T1557.003]. Data exfiltration is achieved by posting stolen credentials to webhook endpoints using HTTP POST requests over exfiltration via webhook [T1567.004], while botnet malware hijacks network resources for large-scale data exfiltration through bandwidth hijacking [T1496.002]. To mask traffic, actors register suspicious DNS A records for domains like 'cdn-service.org' using fast flux DNS [T1568.001].\n\n**Impact**\nThe campaign culminates in a denial-of-service attack where scripts execute ACK floods against database servers, consuming processing capacity through OS exhaustion floods [T1499.001]. This disrupts operations and highlights the need for robust incident response.\n\n**Mitigation Recommendations**\nBlue teams should implement multi-factor authentication, monitor for unusual DNS and network traffic, and conduct regular security awareness training to counter spearphishing attempts. Logs from this scenario include routine system updates and user login attempts, which are not indicative of malicious activity but should be reviewed for anomalies.",
    "sentence_annotations": [
        {
            "sentence": "**Initial Access and Reconnaissance**\nThe campaign begins with actors conducting reconnaissance by enumerating compromised web application resources to identify additional endpoints and resources linked to victim-owned websites.",
            "technique_id": "T1594",
            "technique_name": "Search Victim-Owned Websites"
        },
        {
            "sentence": "Additionally, the malware utilizes LoadLibrary to load shared network communication modules for data exfiltration.",
            "technique_id": "T1129",
            "technique_name": "Shared Modules"
        },
        {
            "sentence": "003] and use tools like CrackMapExec to discover password policies applied to target systems.",
            "technique_id": "T1201",
            "technique_name": "Password Policy Discovery"
        },
        {
            "sentence": "exe to export email messages to local PST files for email collection and run commands like 'forfiles /p D:\\ /s /m *.",
            "technique_id": "T1114",
            "technique_name": "Email Collection"
        },
        {
            "sentence": "docx' to find Word documents on external drives for data from removable media.",
            "technique_id": "T1025",
            "technique_name": "Data from Removable Media"
        }
    ],
    "llm_raw_response": {
        "title": "Joint Cybersecurity Advisory: Simulated Campaign by Fictional Threat Actor 'Crimson Serpent'",
        "summary": "This advisory details a fictional, educational campaign by the threat actor 'Crimson Serpent' targeting financial institutions for blue team training. The campaign involves sophisticated spearphishing, reconnaissance, and data exfiltration techniques, culminating in a denial-of-service attack. Actors likely conduct initial reconnaissance [T1594] and deploy spearphishing links [T1598.003] to gain access, followed by credential harvesting, lateral movement, and resource hijacking.",
        "full_report_text": "Crimson Serpent, a fictional advanced persistent threat (APT) group, has been observed targeting financial organizations in a simulated campaign designed for cybersecurity training. The group operates with a focus on stealth and persistence, leveraging multiple attack vectors to compromise systems and exfiltrate sensitive data.\n\n**Initial Access and Reconnaissance**\nThe campaign begins with actors conducting reconnaissance by enumerating compromised web application resources to identify additional endpoints and resources linked to victim-owned websites [T1594]. Concurrently, they craft spearphishing emails with hyperlinks designed to trick recipients into revealing account credentials [T1598.003], and use social media channels to spearphish victims via services [T1566.003]. Upon successful phishing, the actors gain initial foothold into the network.\n\n**Execution and Persistence**\nOnce inside, the adversary employs AppleScript [T1059.002] to inject malicious JavaScript into browsers while executing processes in hidden windows [T1564.003] to avoid detection. They install and configure dnsmasq to act as a local DNS server for covert communication [T1583.002] and deploy malicious firmware on network interface cards to enable persistent command and control [T1542.002]. Additionally, the malware utilizes LoadLibrary to load shared network communication modules for data exfiltration [T1129].\n\n**Credential Access and Discovery**\nThe actors collect stored passwords from Windows Credential Manager to access local user accounts [T1078.003] and use tools like CrackMapExec to discover password policies applied to target systems [T1201]. They also execute Outlook.exe to export email messages to local PST files for email collection [T1114] and run commands like 'forfiles /p D:\\ /s /m *.docx' to find Word documents on external drives for data from removable media [T1025].\n\n**Lateral Movement and Exfiltration**\nFor lateral movement, the malware uses DHCP protocol to redirect client traffic through an attacker-controlled proxy via DHCP spoofing [T1557.003]. Data exfiltration is achieved by posting stolen credentials to webhook endpoints using HTTP POST requests over exfiltration via webhook [T1567.004], while botnet malware hijacks network resources for large-scale data exfiltration through bandwidth hijacking [T1496.002]. To mask traffic, actors register suspicious DNS A records for domains like 'cdn-service.org' using fast flux DNS [T1568.001].\n\n**Impact**\nThe campaign culminates in a denial-of-service attack where scripts execute ACK floods against database servers, consuming processing capacity through OS exhaustion floods [T1499.001]. This disrupts operations and highlights the need for robust incident response.\n\n**Mitigation Recommendations**\nBlue teams should implement multi-factor authentication, monitor for unusual DNS and network traffic, and conduct regular security awareness training to counter spearphishing attempts. Logs from this scenario include routine system updates and user login attempts, which are not indicative of malicious activity but should be reviewed for anomalies.",
        "techniques_used": [
            "T1594",
            "T1598.003",
            "T1566.003",
            "T1059.002",
            "T1564.003",
            "T1583.002",
            "T1542.002",
            "T1129",
            "T1078.003",
            "T1201",
            "T1114",
            "T1025",
            "T1557.003",
            "T1567.004",
            "T1496.002",
            "T1568.001",
            "T1499.001"
        ]
    }
}